Botella Cool Gear plástica cylinder capacidad de 32 onzas - 1 Ud,2.500,N/A,https://www.walmart.co.cr/cg-botella-plastica-cylinder-de-32-onz/p
Centro De Entretenimiento Haus Para Tv 37 Pulgadas,21.500,N/A,https://www.walmart.co.cr/centro-entretenimiento-haus-para-tv-37-pulgadas-4/p
Maleta Harry Potter color roja 20 pulgadas,39.900,N/A,https://www.walmart.co.cr/maleta-no20-harry-potter-azul-83/p
Maleta Bob Esponja amarilla 20 pulgadas,39.900,N/A,https://www.walmart.co.cr/maleta-no20-bob-esponja-amarillo-84/p
Alfombras para auto Disney mandalorian star wars,17.200,N/A,https://www.walmart.co.cr/alfombras-p-auto-mandalorian-star-wars-4/p
Mueble Mainstays Oslo Para Tv Surtido Color - 60 Pulgadas,87.900,N/A,https://www.walmart.co.cr/rack-mainstays-para-tv-60-oslo/p
Extension Electrica Hyper Tough 4m Hogar,2.650,N/A,https://www.walmart.co.cr/extension-electrica-hyper-tough-4m-hogar/p
"Mesa Mainstays, rectangular de resina -122cm",22.500,N/A,https://www.walmart.co.cr/mainstays-mesa-resina-rectangular-122-cm-4/p
Maleta Mainstays material ABS Color Negro - 20 Pulgadas,27.500,N/A,https://www.walmart.co.cr/maleta-mainstays-ind-abs-color-negro-20-pulgadass-4/p
"Marcadores Pen Gear, infantiles -12 pzas",350,N/A,https://www.walmart.co.cr/harry-po-dores-infantiles-12-piezas/p
Juego de comedor Mainstays 4 pzas,139.900,N/A,https://www.walmart.co.cr/juego-mainstays-de-comedor-4piezas/p
Sillón Mainstays reclinable doble de cuero color café,394.900,N/A,https://www.walmart.co.cr/ms-sillon-reclinable-doble-leather-gel/p
Brocha Backyard Grill De Silicona Para BBQ,1.540,N/A,https://www.walmart.co.cr/brocha-silicona-para-bbq-bacyard-grill/p
Zapatera Mainstays 4 Niveles Blanca - Unidad,7.500,N/A,https://www.walmart.co.cr/zapatera-mainstays-niveles-blanca-unidad/p
Cobertor Para Carro Auto Drive -Unidad,18.500,N/A,https://www.walmart.co.cr/cobertor-para-carro-auto-drive-unidad-4/p
Toalla De Mano Gris Haus,650,N/A,https://www.walmart.co.cr/toalla-de-mano-gris-haus/p
Espatulas Mainstays Set - 3 Unidades,800,N/A,https://www.walmart.co.cr/set-espatulas-mainstays-4/p
Extintor de fuego Herbie portatil abc recargable capacidad 1 kg,10.300,N/A,https://www.walmart.co.cr/extintor-de-fuego-herbie-portatil-abc-recargable-capacidad-1-kg-/p
Gavetero Guateplast Premium Ratan  color Beige - unidad,38.000,N/A,https://www.walmart.co.cr/gavetero-premium-ratan-guateplast-beige-0/p
"Juego Sabanas Individual Mainstays, Infantil",6.900,N/A,https://www.walmart.co.cr/set-sabanas-mainstays-individual-diseno/p
Tenedor De Mesa Lace Mainstays,430,N/A,https://www.walmart.co.cr/tenedor-de-mesa-lace-mainstays-26/p
Cobertor Expert Grill para parrilla -152x66x122 cm,10.500,N/A,https://www.walmart.co.cr/eg-funda-para-parrilla-152x122cm/p
Mini Gel Glade para automóvil lavanda marina - 70 g,1.460,N/A,https://www.walmart.co.cr/mini-gel-car-lavanda-marina-glade-70g-4/p
Basurero Con Tapa 42Lts Organicos Verde,7.250,N/A,https://www.walmart.co.cr/basurero-con-tapa-42lts-organicos-verde/p
Vaso Mainstays Lineas Horizontales 11 onzas,390,N/A,https://www.walmart.co.cr/vaso-11-onzas-lineas-horizontales/p
Plaguicida Líquido Ever Green Multiacción Orgánico - 1Lt,6.900,N/A,https://www.walmart.co.cr/fertilizante-evergreen-multiaccion-1lt-4/p
Pretul Manguera 2 Capas Flexble 15M Azul,7.300,N/A,https://www.walmart.co.cr/pretul-manguera-capas-flexble-15m-azul-4/p
Aromatizante Patricio Fresa,1.000,N/A,https://www.walmart.co.cr/aromatizante-patricio-fresa/p
Crayón Crayola Estandar 24 unidades,1.500,N/A,https://www.walmart.co.cr/crayon-crayola-estandar-24ea/p
Aromatizante Glade minigel car deleite floral - 70 g,1.460,N/A,https://www.walmart.co.cr/aromatizante-glade-minigel-car-deleite-floral-70gr-4/p
Sarten George Home - 24cm,6.900,N/A,https://www.walmart.co.cr/sarten-george-home-24cm/p
Cortina Tergal Beige Tamano 3X2.20 Cm,6.650,N/A,https://www.walmart.co.cr/cortina-tergal-beige-tamano-3x2-20-cm/p
Cuchillo 7 Pulgadas,1.000,N/A,https://www.walmart.co.cr/cuchillo-7-pulgadas-206-20nov24/p
Cobertor Expert Grill para parrilla -65 pulgadas,11.500,N/A,https://www.walmart.co.cr/eg-funda-para-parrilla-165x102cm/p
Vaso Whiskero 521 Vidrio Santos 330 Ml,590,N/A,https://www.walmart.co.cr/vaso-whiskero-521-vidrio-santos-330-ml-4/p
Cucharas De Mesa Lace Mainstays,380,N/A,https://www.walmart.co.cr/cucharas-de-mesa-lace-mainstays-37/p
"Caja Herramientas Rimax, color negro -19 pulgadas",8.400,N/A,https://www.walmart.co.cr/caja-herramientas-rimax-19-plg-negro-5360-xp-4/p
Caja Home Pro Organizadora Con Cierre - 24lt,5.300,N/A,https://www.walmart.co.cr/caja-organizadora-home-pro-con-cierre-24lt-4/p
Paletas Pen Gear para pintura - 3 pzas,1.200,N/A,https://www.walmart.co.cr/set-de-paletas-para-pintura-4/p
Extension Electrica Hyper Tough 4m Hogar,2.550,N/A,https://www.walmart.co.cr/extension-electrica-hyper-tough-4m-hogar-2/p
"Planchador Mainstays, Metálico Pata En T",12.000,N/A,https://www.walmart.co.cr/planchador-mainstays-metalico-pata-en-t/p
Pulidor Ebullient de Vidrios Removedor de Ojo De Pescado y de Facil Uso - 236.5ml,3.500,N/A,https://www.walmart.co.cr/limpiavidrios/p
Canasta Home Pro ratán ovalada para ropa - 1 ud,2.850,N/A,https://www.walmart.co.cr/canasta-ropa-rattan-ovalo-40-lts/p
Goma Barra Resistol -40 g,1.300,N/A,https://www.walmart.co.cr/barra-adhesivas-resistol-40-gr-4/p
Truper Empaque De Hule Manguera 10 Pzs,500,N/A,https://www.walmart.co.cr/truper-empaque-hule-manguera-10-pzs-4/p
Aromatizante para autos Little Trees aroma a fresa,1.420,N/A,https://www.walmart.co.cr/little-tree-aromatizante-car-freshner-pinito-fresa-1pack-4/p
Abridor Oster de botellas,1.000,N/A,https://www.walmart.co.cr/abridor-de-botellas-oster/p
Limpiador Expert Grill para parrilla,2.500,N/A,https://www.walmart.co.cr/eg-limpiador-para-parrilla/p
Semillas Sol Naciente Chile Dulce,1.100,N/A,https://www.walmart.co.cr/semillas-marca-sol-naciente-chile-dulce/p
Semillas Crisantemo Mixto Sol Naciente,1.080,N/A,https://www.walmart.co.cr/semillas-crisantemo-mixto-marca-sol-naciente/p
Caja Organizadora Soluc Mainstays 40L,6.100,N/A,https://www.walmart.co.cr/caja-organizadora-soluc-mainstays-40l/p
Brocha Mainstays Para Untar,800,N/A,https://www.walmart.co.cr/brocha-p-untar-mainstays/p
Escritorio Mainstays para computadora JX-18B184A,27.500,N/A,https://www.walmart.co.cr/escritorio-mainstays-para-computadora-8/p
Timer Para Cocina George Home,1.800,N/A,https://www.walmart.co.cr/timer-para-cocina-george-home/p
Pavilo Para Tamales,520,N/A,https://www.walmart.co.cr/pavilo-p-tamales/p
Edredón Home Deco Queen,14.500,N/A,https://www.walmart.co.cr/edredon-queen-home-deco-4/p
Marcador Artline 107 Permanente 2 unidades,1.200,N/A,https://www.walmart.co.cr/marcador-artline-107-permanente-2-unidades/p
Almohada Dormiplus Queen relleno Plumas de Ganso,9.900,N/A,https://www.walmart.co.cr/almohada-lujo-relax-tech/p
Alfombra Mainstays antideslizante para baño,3.600,N/A,https://www.walmart.co.cr/alfombra-marca-mainstays-masajeadora/p
Protector de Colchón acolchonado Individual,12.700,N/A,https://www.walmart.co.cr/protector-de-colchon-acolchonado-individual/p
Lona De Polietileno Hyper Tought Color Azul 2x3 mts,2.765,N/A,https://www.walmart.co.cr/lona-marca-hyper-tough-de-polietileno-color-azul-2x3/p
Escalera De Aluminio Hyper Tough 3 Peldaños,22.900,N/A,https://www.walmart.co.cr/escalera-de-aluminio-marca-hyper-tough-3-peldanos/p
Almohada Dormiplus Dreams,2.000,N/A,https://www.walmart.co.cr/almohada-dormiplus-dreams-40x60/p
Lampara Mainstays Solar Para Jardín Tipo Farol,1.900,N/A,https://www.walmart.co.cr/ms-lampara-solar-tipo-farol/p
Espejo Mainstays Rectangular Con Marco,4.500,N/A,https://www.walmart.co.cr/espejo-mainstays-rectangular-con-marco/p
Caja Home Pro Organizadora  Con Cierre - 10lt,3.000,N/A,https://www.walmart.co.cr/caja-organizadora-c-cierre-10l-home-pro-4/p
Set Mainstays Plato Plano Plástico 6 Piezas,1.300,N/A,https://www.walmart.co.cr/mainstays-set-plato-plano-plastico-6pcs/p
Sarten Mainstays Color Negro - 24 cm,3.900,N/A,https://www.walmart.co.cr/sarten-mainstays-color-negro-24-cm-4/p
Cuchillo Mainstays Para Cocina,800,N/A,https://www.walmart.co.cr/cuchillo-p-cocina-mainstays-2/p
Nota Adhesiva Post It Summer Joy - 1Ud,1.200,N/A,https://www.walmart.co.cr/post-it-nota-summ-joy-3x3/p
Frasco Zibo con tapa y sticker para usar tiza,800,N/A,https://www.walmart.co.cr/tarro-hermet-vidrio-pizarron-zibo/p
Cinta Empaque Tesa Transparente 90Mx48Mm  - 1 Unidad,2.200,N/A,https://www.walmart.co.cr/cinta-empaque-tesa-transparente-90m-1u-4/p
Masilla Lanco Color Blanco Multiusos- 8oz,1.800,N/A,https://www.walmart.co.cr/masilla-lanco-blanca-8oz/p
Cortina Para Baños Mainstays Blanca,1.700,N/A,https://www.walmart.co.cr/cortina-para-banos-marca-mainstays-blanca/p
Cinta Montaje Scotch Extremo - 1Ud,6.800,N/A,https://www.walmart.co.cr/cinta-marca-scotch-mounting-tape-extremo/p
Recipiente Mainstays Vidrio Con Seguro Mediano,2.000,N/A,https://www.walmart.co.cr/recipiente-vid-c-seguro-mainstays-med/p
