"Mesa Mainstays Plegable De 6 PiesTamaño Del Producto (Cm): 182,8X76X73,7 CmDoblado A La Mitad. Tablero De Pp Moldeado Al Vacío",28.900,N/A,https://www.walmart.co.cr/mesa-plegable-plastica-azul-mainstays-182-cm/p
Silla de Resina Plegable Mainstays Robusta -unidad,13.200,N/A,https://www.walmart.co.cr/silla-resina-mainstays-plegable-robusta-unidad/p
Prensas  Mainstays  De Ropa Madera- 20 Piezas,450,N/A,https://www.walmart.co.cr/prensas-ropa-madera-mainstays-20-piezas-4/p
Tendedero Mainstays 18 Prensas Ovalado - Unidad,1.400,N/A,https://www.walmart.co.cr/tendedero-mainstays-18-prensas-ovalado-unidad/p
Almohada American Dream Blanca 2 unidades 144H,5.900,N/A,https://www.walmart.co.cr/almohada-american-dream-blanca-2-unidades-144h/p
Planchador Metálico Mainstays 4 Patas - Unidad,12.000,N/A,https://www.walmart.co.cr/planchador-metalico-mainstays-patas-unidad-4/p
Bolig Bic Dura Mas Azul Cj 12,1.500,N/A,https://www.walmart.co.cr/bolig-bic-dura-mas-azul-cj-12-4/p
Colchón marca Kingkoil Tamaño King Resplandor,310.000,N/A,https://www.walmart.co.cr/colchon-marca-king-koil-king-resplandor/p
Rodillo De Silicon Mainstays Con Mango De Bambu - Unidad,2.800,N/A,https://www.walmart.co.cr/rodillo-silicon-mainstays-con-mango-bambu-unidad-4/p
Caja organizadora Home pro colores surtidos y capacidad 60 L,6.900,N/A,https://www.walmart.co.cr/caja-organizadora-home-pro-smart-box-60-lts/p
Set Sarten Mainstays 3 Piezas 18 - 22 - 24 cm,8.2006.800,N/A,https://www.walmart.co.cr/set-sarten-mainstays-piezas-18-22-24-cm-4/p
Espejo Home Trends redondo con borde dorado 70 cm,17.000,N/A,https://www.walmart.co.cr/ht-espejo-redondo-borde-dorado-70cm/p
Hielera Igloo Wheelie 38 QT Surtido Color Con Rodines,26.40023.500,N/A,https://www.walmart.co.cr/hielera-igloo-wheelie-multicolor-38-qt-4/p
Vela Quemador 50Unid Frangus,4.500,N/A,https://www.walmart.co.cr/vela-tea-light-frangus-50-unidades-4/p
Almacenador En Forma De Cebolla,600,N/A,https://www.walmart.co.cr/almacenador-en-forma-cebolla-5/p
Atomizador Guateplast Natural Grande - 32oz,1.640,N/A,https://www.walmart.co.cr/atomizador-guateplast-natural-grande-32oz-4/p
Tapa Plástica Para Microndas Good Cook,2.350,N/A,https://www.walmart.co.cr/tapa-plastica-para-microndas-good-cook-2/p
Bolig Bic Dura Mas Negro Cj 12,1.500,N/A,https://www.walmart.co.cr/bolig-bic-dura-mas-negro-cj-12-4/p
Cuaderno Doble Anillo Pasta Semi Dura Tamaño Profesional Multimateria,2.000650,N/A,https://www.walmart.co.cr/cuaderno-doble-o-pasta-sd-100h-pro-matte-5/p
Cuaderno Doble Anillo Pasta Semi Dura Tamaño Profesional Multimateria,2.000650,N/A,https://www.walmart.co.cr/cuaderno-doble-o-pasta-sd-100h-pro-matte-3/p
Cuaderno Doble Anillo Pasta Semi Dura Tamaño Profesional Multimateria,2.000650,N/A,https://www.walmart.co.cr/cuaderno-doble-o-pasta-sd-100h-pro-matte-7/p
Cuaderno Doble Anillo Pasta Semi Dura Tamaño Profesional Multimateria,2.000650,N/A,https://www.walmart.co.cr/cuaderno-doble-o-pasta-sd-100h-pro-matte-10/p
Vaso con pajilla Lilo & Stitch diseño divertido para niños,850450,N/A,https://www.walmart.co.cr/vaso-con-pajilla/p
Escalera Hyper Tough de 2 escalones color negro,5.5004.500,N/A,https://www.walmart.co.cr/taburette-plastico-2-peldanos-hyper-t-4/p
Llanta Goodride 175/70 rin 13 rp28,20.50018.400,N/A,https://www.walmart.co.cr/llanta-goodride-175-70-rin-13-rp28-/p
Pulidora Autodrive Para Auto - unidad,34.00025.000,N/A,https://www.walmart.co.cr/pulidora-autodrive-para-auto-10/p
Mueble de TV Vance Fresno Europeo,75.900,N/A,https://www.walmart.co.cr/mueble-tv-vance-fresno-europeo-capri/p
Gavetero plástico Uchosa 4 niveles colores surtidos,13.500,N/A,https://www.walmart.co.cr/gavetero-uchosa-niveles-grande/p
Maleta Stitch Azul,27.900,N/A,https://www.walmart.co.cr/maleta-20-stitch-azul/p
"Lapiceros Paper Mate, paquete -3 uds",500,N/A,https://www.walmart.co.cr/lapicero-papermate-inkjoy100-n-a-r-blister-3/p
Basurero Disney mini lilo y stitch -1500 ml,1.200,N/A,https://www.walmart.co.cr/mini-basurero-1500ml/p
GomaPritt en Barra lápiz adhesivo 3 piezas - 11 g,2.300,N/A,https://www.walmart.co.cr/lapiz-adhesivo-pritt-3x11g-blister-4/p
Llanta Firestone 185/65 R15 88t all season,31.700,N/A,https://www.walmart.co.cr/llanta-firestone-185-65-r15-88t-all-season/p
Caja Transp Con Tapa,499,N/A,https://www.walmart.co.cr/caja-transp-con-tapa/p
Ms Mesa De Centro Vidrio D91 4cm,34.900,N/A,https://www.walmart.co.cr/ms-mesa-de-centro-vidrio-d91-4cm/p
Mantel Hometrends -150 cm,3.900,N/A,https://www.walmart.co.cr/mantel-hometrends-150-cm/p
Toalla De Playa Haus Azul,3.5002.000,N/A,https://www.walmart.co.cr/toalla-de-playa-haus-azul/p
Paños De Microfibra Auto D rive Multiproposito Pqte 24 Uds Pk024-16,6.500,N/A,https://www.walmart.co.cr/toallas-microfibra-multiusos-24pk/p
Cortina de baño Mainstays,3.300,N/A,https://www.walmart.co.cr/cortina-tela-estampado-fun/p
Escritorio Minstays para computadora color variado modelo JX-18B184B,27.500,N/A,https://www.walmart.co.cr/escritorio-mainstays-para-computadora-13/p
Comedor Mainstays set de 7 piezas color café,354.900,N/A,https://www.walmart.co.cr/set-de-comedor-cafe-marca-mainstays-150cm-7-piezas/p
Set de mesas Mainstays blancas con patas de madera - 2 Pzas,19.900,N/A,https://www.walmart.co.cr/ms-set-2-mesas-auxi-blancas-patas-madera/p
Molde Redondo Mainstays Para Pastel,1.000,N/A,https://www.walmart.co.cr/molde-redondo-pastel-mainstays/p
Molde Galletas Mainstays 15,1.600,N/A,https://www.walmart.co.cr/molde-galletas-mainstays-15/p
Guante Mainstays de cocina para horno,2.500,N/A,https://www.walmart.co.cr/guante-mainstays-de-cocina/p
Regla Quick Flexible De Acero 30Cm,1.300,N/A,https://www.walmart.co.cr/regla-quick-flexible-de-acero-30cm/p
Maleta Minne Colores 20,29.900,N/A,https://www.walmart.co.cr/maleta-minne-colores-20/p
Aromatizante Patricio New Car,1.000,N/A,https://www.walmart.co.cr/aromatizante-patricio-new-car/p
Cesta  Mainstays  Plegable Blanco Y Negro - Unidad,1.000,N/A,https://www.walmart.co.cr/cesta-plegable-mainstays-blanco-y-negro-unidad/p
Set 3Pcs Tenedor De Mesa Tramontina,1.750,N/A,https://www.walmart.co.cr/set-3pcs-tenedor-mesa-tramontina/p
Organizador Mainstays 3 Niveles Blanco,10.500,N/A,https://www.walmart.co.cr/organizador-mainstays-niveles-blanco/p
Basurero Pedal 30l Con Pedal,14.000,N/A,https://www.walmart.co.cr/basurero-pedal-30l-con-pedal/p
"Batería Energizer,Blister AA -16 uds",4.670,N/A,https://www.walmart.co.cr/bateria-energizer-blister-aa-16u-1ea/p
"Edredón Individual Mainstays Kids, multicolor -3 pzas",15.500,N/A,https://www.walmart.co.cr/msk-edredon-abby-3pzs-twin-multi/p
Pegamento 3M scotch super glue líquido - 1 ud,1.600,N/A,https://www.walmart.co.cr/pegamento-scotch-super-glue-liquido-1-unidad-4/p
Incienso Ganesha Copal Jazmin 20Pz Ea 1,1.000,N/A,https://www.walmart.co.cr/incienso-ganesha-copal-jazmin-20pz-ea-1-115/p
Semillas Sol Naciente Lechuga Mixta,1.100,N/A,https://www.walmart.co.cr/semillas-marca-sol-naciente-lechuga-mixta/p
Rack Mainstays Organizador 3 Niveles Negro,9.900,N/A,https://www.walmart.co.cr/rack-mainstays-organizador-3-niveles-negro/p
Funda Auto Drive Para Asiento Negro Y Rojo,17.000,N/A,https://www.walmart.co.cr/funda-auto-drive-para-asiento-negro-y-rojo/p
Espejo M036 Colores 33.0X48.0 Exhibidor,5.000,N/A,https://www.walmart.co.cr/espejo-m036-colores-33-0x48-0-exhibidor/p
"Canasta Guateplast, Ratan Con Tapa Color Beige 22 Lt",4.000,N/A,https://www.walmart.co.cr/canasta-ratan-c-tapa-22lt-beige/p
Lampara Mainstays Solar Para Jardín Tipo Proyector,4.000,N/A,https://www.walmart.co.cr/ms-lampara-solar-tipo-proyector/p
Set De Sabanas Mainstays Individual Blanco,6.500,N/A,https://www.walmart.co.cr/set-de-sabanas-mainstays-individual-blanco/p
Cuchillo Tramontina Asado 5 Ipanema,450,N/A,https://www.walmart.co.cr/cuchillo-asado-ipanema/p
Mecha Atlas Para Limpieza Y Pulido - 400gr,2.300,N/A,https://www.walmart.co.cr/mecha-para-limpieza-y-pulido-400-g/p
Lampara Mainstays Solar Para Jardín Tubular,800,N/A,https://www.walmart.co.cr/ms-lampara-solar-para-jardin-tubular/p
Alfombra Plastica Mainstays Para Baño -Unidad,1.600,N/A,https://www.walmart.co.cr/alfombra-plastica-mainstays-para-bano-unidad/p
Cinta Doble Cara Multipropósito Transp 10mx12mm,1.500,N/A,https://www.walmart.co.cr/cinta-doble-cara-tesa-multiproposito-bl1/p
Soporte Papel Mainstays Negro Pedesta,5.900,N/A,https://www.walmart.co.cr/soporte-papel-mainstays-negro-pedesta/p
Encendedor Handy Bic Encendedor J6,2.500,N/A,https://www.walmart.co.cr/encendedor-handy-bic-encendedor-j6-4/p
Extension Electrica Hyper Tough 2m Hogar,1.800,N/A,https://www.walmart.co.cr/extension-electrica-hyper-tough-2m-hogar-2/p
Desatorador Escud 500 Ml,2.800,N/A,https://www.walmart.co.cr/desatorador-escud-500-ml/p
"Candela Frangus  Corriente 6 Ud , Color Blanco, Sin Aroma.",900,N/A,https://www.walmart.co.cr/candela-basica-und/p
Aromatizante Little Tree  para Autos  Pinito Azul - 1Pack,1.420,N/A,https://www.walmart.co.cr/little-tree-aromatizante-car-freshner-pinito-azul-1pack-4/p
Hermético Mainstays Vidrio Rectangular 0.59L,1.900,N/A,https://www.walmart.co.cr/hermetico-vidrio-0-59l-rect-mainstays/p
Bateria Alcalina Panasonic AA - 2 unidades,1.800,N/A,https://www.walmart.co.cr/bateria-alcalina-panasonic-aa-unidades/p
"Prensas Mya, para folder Surtido-12 uds",600,N/A,https://www.walmart.co.cr/fastener-buho-plastico-paquete-12-unidades/p
Contenedor Mainstays De Vidrio 650ml,1.800,N/A,https://www.walmart.co.cr/contenedor-mainstays-de-vidrio-650ml/p
"Bombillo Incandescente Sylvania, 75W opaco rosca E27 -Und",670,N/A,https://www.walmart.co.cr/bombillo-sylvania-opaco-75w-cj-4/p
Toalla De Manos Haus Crema,650,N/A,https://www.walmart.co.cr/toalla-de-manos-haus-crema/p
Frazada Bob Esponja 127x152 Cms,7.9005.000,N/A,https://www.walmart.co.cr/frazada-bob-esponja-127x152-cms/p
Escurridor De Platos Haus,3.0001.000,N/A,https://www.walmart.co.cr/escurridor-de-platos-haus/p
Batería Duracell Alcalina Grande D - 2 Unidades,5.5204.550,N/A,https://www.walmart.co.cr/bateria-duracell-alcalina-grande-d-unidades/p
Butaca Mainstays capitoneada color gris,78.98659.900,N/A,https://www.walmart.co.cr/ms-butaca-capitoneada-gris/p
Butaca Mainstays capitoneada color azul,78.98659.900,N/A,https://www.walmart.co.cr/ms-butaca-capitoneada-azul/p
Rallador Ilko Plano Acero Inoxidable 3 Cortes,1.700750,N/A,https://www.walmart.co.cr/rallador-plano-ac-inox-3-cortes-ilko/p
"Estuche Generica, Harry Potter",850200,N/A,https://www.walmart.co.cr/estuche-pequeno-harry-potter-con-escoba/p
"Estuche Generica, Harry Potter",1.300300,N/A,https://www.walmart.co.cr/estuche-grande-harry-potter-con-escoba/p
Set Joie de copas de vino to go 200 ml - 2 Pzas,3.0002.500,N/A,https://www.walmart.co.cr/set-2-copas-de-vino-to-go-joie-4-17mar25/p
"Estuche Generica, Harry Potter",1.300300,N/A,https://www.walmart.co.cr/estuche-grande-harry-potter-con-espada/p
Cuaderno Pen+Gear Uno Reverse Pasta Doble- O Prof - 100 Hojas,2.000650,N/A,https://www.walmart.co.cr/cuaderno-doble-o-pasta-sd-100h-pro-matte/p
Cuaderno El Líder con espiral diseños surtidos - 80 hojas,950500,N/A,https://www.walmart.co.cr/cuadernoespiral80hsurtivalumujer/p
Termo Para Cafe Plastico 1 L Mainstays,3.0002.000,N/A,https://www.walmart.co.cr/termo-para-cafe-plastico-1-l-mainstays-40-16ene25/p
Llanta Kumho para automóvil 175/70 Rin13,26.00023.000,N/A,https://www.walmart.co.cr/llanta-kumho-175-70r13/p
Molde Mainstays para pizza - 1 unidad,1.400,N/A,https://www.walmart.co.cr/molde-pizza-maainstays/p
Basurero Mainstays Con Pedal de Acero Color Negro - 5 L,6.750,N/A,https://www.walmart.co.cr/ms-basurero-con-pedal-de-acero-negro-5-l/p
Mueble para zapatos Mainstays de 4 niveles -60x26x72 cm,7.300,N/A,https://www.walmart.co.cr/mueble-zapatos-4niveles-gavet-60x26x72cm/p
Limpiador y protector Meguiars para interiores de auto con brillo - 473 ml,7.900,N/A,https://www.walmart.co.cr/limpiador-y-protector-dash-brillo-auto/p
Cocina Vox Portatil Gas Butano con Encendido electrónico,16.90014.900,N/A,https://www.walmart.co.cr/cocina-gas-portatil-vox-4/p
"Bombillo Led Sylvania, 9W Luz blanca rosca E27 -2 Uds",2.300,N/A,https://www.walmart.co.cr/2pk-led-a60-blanco-9-5w-slyvania/p
Closet Mainstays infantil -75x45x140 cm,7.000,N/A,https://www.walmart.co.cr/closet-infantil-w75xd45xh140cm/p
Vela aromática Mainstays aroma eucalipto -100 g,1.200,N/A,https://www.walmart.co.cr/vela-aromatica-mainstays-aroma-eucalipto-100-g/p
Tabla Expert Grill para cortar de madera,3.500,N/A,https://www.walmart.co.cr/tabla-expert-grill-de-madera/p
Set Mainstays de hermeticos - 4 Uds,980,N/A,https://www.walmart.co.cr/set-mainstays-de-hermeticos-4-uds/p
Cinta Scotch Cristal Dispensador - 1Ud,3.250,N/A,https://www.walmart.co.cr/cinta-scotch-cristal-con-dispensador-19-mm-x-20m-4/p
Contenedor Joie de silicon para freidora aire - 1 Ud,2.500,N/A,https://www.walmart.co.cr/contenedor-silicon-para-freidora-aire-jo/p
Parrilla de carbón Expert Grill de alta resistencia de hierro fundido -24 pulgadas,119.900,N/A,https://www.walmart.co.cr/parrilla-marca-expert-grill-carbon-con-rodines-deluxe/p
Cinta Quick Doble Cara Montaje Rollo,1.200,N/A,https://www.walmart.co.cr/cinta-quick-doble-cara-montaje-rollo/p
"Lonchera termica Yolo, estampado de corazones color rosado",5.0001.000,N/A,https://www.walmart.co.cr/lonchera-termica-azul/p
"Silla Plegable Ozark Trail Con Mesa Para Lata Surtido Color 80.7cm, 31cm - 136kg",11.9009.900,N/A,https://www.walmart.co.cr/silla-para-camping-director-ozark-trail-unidad/p
Colchón Queen confort life edición especial,249.900,N/A,https://www.walmart.co.cr/colchon-queen-confort-life-edicion-especial/p
Maleta Star Wars color negro 20 pulgadas,23.900,N/A,https://www.walmart.co.cr/maleta-no20-star-wars-negro-82/p
Carbón Great Value Briquetas Bolsa 5kg,5.7004.890,N/A,https://www.walmart.co.cr/great-value-briquetas-carbon-bolsa-kg/p
Atomizador Pequeño (16 Oz/475 Ml) Natural 0,1.340,N/A,https://www.walmart.co.cr/atomizador-pequeno-16-oz-475-ml-natural-0-4/p
Papel Bond Tamano Carta Facela,1.950,N/A,https://www.walmart.co.cr/papel-bond-tamano-carta-facela/p
Colchón Confort life Tamaño Queen diamante,219.900197.900,N/A,https://www.walmart.co.cr/confort-life-colchon-queen-diamante/p
Escurridor Kitchen Pro Doble Nivel,4.900,N/A,https://www.walmart.co.cr/escurridor-kitchen-pro-doble-nivel/p
Gavetero Uchosa 5 Niveles Grande Surtido,15.500,N/A,https://www.walmart.co.cr/gavetero-uchosa-niveles-grande-2/p
Goma Blanca Resistol Liquida 120 Ml,850,N/A,https://www.walmart.co.cr/goma-blanca-resistol-liquida-120-ml/p
Toldo plegable Ozark Trail color rojo - 3 x 3 m,17.900,N/A,https://www.walmart.co.cr/toldo-plegable-ozark-trail-3x3-m-beige-4/p
Mini Compresor Auto Drive Automotriz,8.500,N/A,https://www.walmart.co.cr/mini-compresor-auto-drive-automotriz-unidad-4/p
"Mesa Mainstays, rectangular de resina -182cm",27.500,N/A,https://www.walmart.co.cr/mainstays-mesa-resina-rectangular-182-cm-4/p
Cepillo Mainstays De Acero color Negro para baño,3.380,N/A,https://www.walmart.co.cr/ms-escobillero-de-acero-negro/p
Set de sábanas American Dream matrimonial color blanco - 4 pzas,9.500,N/A,https://www.walmart.co.cr/american-dream-sabanas-matrimonial-bca/p
Alcalinizador Great Value - 14 L,33.500,N/A,https://www.walmart.co.cr/alcalinizador-marca-great-value-14l/p
Batería Panasonic Alcalina  Evolta AA - 6 Unidades,3.900,N/A,https://www.walmart.co.cr/bateria-panasonic-alcalina-evolta-aa-unidades-4/p
Escud Acido Muriatico Limpiador Gln,3.350,N/A,https://www.walmart.co.cr/escud-acido-muriatico-limpiador-gln-4/p
Rotuladores Pen Gear de colores Surtido - 10 uds,700,N/A,https://www.walmart.co.cr/pen-gear-rotuladores-surtidos-4/p
Lápices grafito Pen Gear caja -12 uds,500,N/A,https://www.walmart.co.cr/caja-de-12lapices-grafito-hexagonales/p
Grapadora metálica Facela tira completa,1.800,N/A,https://www.walmart.co.cr/facela-engrapadora-tira-completa-4/p
Juego Utensilios Cocina 5pzs Acero,11.700,N/A,https://www.walmart.co.cr/juego-utensilios-cocina-5pzs-acero/p
Zapatera Mainstays De Puerta para 36 Pares,13.000,N/A,https://www.walmart.co.cr/zapatera-puerta-36-pares-mainstays/p
Set Mainstays Ganchos  Metal Antides - 10 piezas,3.200,N/A,https://www.walmart.co.cr/set-ganchos-mainstays-10pz-metal-antides/p
Escobilla Goodyear Aero 24,4.300,N/A,https://www.walmart.co.cr/escobilla-goodyear-aero-24/p
Maleta Minne Gris 20 Disney,29.900,N/A,https://www.walmart.co.cr/maleta-minne-gris-20-disney/p
Aerosol WD-40 multiuso - 227 g,3.300,N/A,https://www.walmart.co.cr/wd-40-presentacion-8-0-onzas/p
Nk Set De 30 Hielos,790,N/A,https://www.walmart.co.cr/nk-set-de-30-hielos-30-23dic24/p
Ms Salero De Vidrio 60ml,250,N/A,https://www.walmart.co.cr/ms-salero-de-vidrio-60ml/p
Olla Presion Mainstays - 7 Lts,16.900,N/A,https://www.walmart.co.cr/olla-presion-mainstays-lts-4/p
Organizador Infantil Mainstays con 5 divisiones,39.900,N/A,https://www.walmart.co.cr/ms-organizador-infantil-5-divisiones/p
Pg Maleta Rigida Azul 20in,27.900,N/A,https://www.walmart.co.cr/pg-maleta-rigida-azul-20in/p
Cuchara Mainstays Azul,700,N/A,https://www.walmart.co.cr/cuchara-mainstays-azul/p
Edredón Queen Mainstays estrellas,17.500,N/A,https://www.walmart.co.cr/edredon-mainstays-set-4-piezas-size-queen/p
Haus Contenedor Plastico 1500 Ml,1.400,N/A,https://www.walmart.co.cr/haus-contenedor-plastico-1500-ml/p
Roland Pinchos De Bambu Num 10 5240,1.700,N/A,https://www.walmart.co.cr/roland-pinchos-bambu-num-10-5240-4/p
Alfombra de baño Mainstays infantil,2.600,N/A,https://www.walmart.co.cr/ms-alfombra-para-bano-dn/p
Linterna 9 Led Pdq Handiworks,900,N/A,https://www.walmart.co.cr/linterna-led-pdq-handiworks-4/p
Taza Good Cook Para Medir 19860 - Set 4,1.500,N/A,https://www.walmart.co.cr/taza-good-cook-para-medir-19860-set-4-4/p
Clips Pen Gear Surtido - 100 pzas,400,N/A,https://www.walmart.co.cr/pen-gear-clips-100-pz/p
Recipiente Rect Kitchen Pro De 1300ml,650,N/A,https://www.walmart.co.cr/recipiente-rect-kitchen-pro-de-1300ml/p
Vela Aromatica 8 Oz Melocoton De Georgia,1.900,N/A,https://www.walmart.co.cr/vela-aromatica-8-oz-melocoton-de-georgia/p
Brocha Hyper Tough 2 Mango De Madera,1.000,N/A,https://www.walmart.co.cr/brocha-hyper-tough-2-mango-de-madera/p
Semillas Sol Naciente Tomate Cerise,1.100,N/A,https://www.walmart.co.cr/semillas-marca-sol-naciente-tomate-cerise/p
Tokai Cartucho Repuesto Encendedor C Gas,700,N/A,https://www.walmart.co.cr/tokai-cartucho-repuesto-encendedor-c-gas-4/p
Pelador George Hom De Verduras,520,N/A,https://www.walmart.co.cr/pelador-george-hom/p
Machucador Negro George Home,1.200,N/A,https://www.walmart.co.cr/machucador-negro-george-home/p
Petate para playa Ozark Trail plegable - 90 x 180cm,1.990,N/A,https://www.walmart.co.cr/petate-playa-ozark-trail-90x180cm-unidad/p
Alfombra Mainstays Para Baño Rayas 40x60c,3.100,N/A,https://www.walmart.co.cr/alfombra-de-bano-a-rayas-40x60c-4/p
Basurero Pedal 15l Con Pedal,11.200,N/A,https://www.walmart.co.cr/basurero-pedal-15l-con-pedal/p
Kit de repuestos Great Value para filtro purificador - 2 lb,15.900,N/A,https://www.walmart.co.cr/kit-repuesto-alcalinizador-marca-great-value/p
"Bombillo Incandescente Sylvania, 50W opaco rosca E27 -Und",500,N/A,https://www.walmart.co.cr/bombillo-sylvania-opaco-50w-cj/p
Tabla Guateplast para Picar Surtido - unidad,2.000,N/A,https://www.walmart.co.cr/cross-tabla-pa-picar-guateplast-surtido-0/p
Set De Fundas Mainstays Bordado Azul 2 unidades,4.000,N/A,https://www.walmart.co.cr/set-de-fundas-mainstays-bordado-azul-2-unidades/p
Pinceles de Esponja Pen Gear -15 uds,1.300,N/A,https://www.walmart.co.cr/set-de-pinceles-de-esponja-15-unidades/p
"Lija Aksi, De Agua Grano 80",300,N/A,https://www.walmart.co.cr/lija-de-agua-grano-80/p
Porta Papel Mainstays Cromado,3.900,N/A,https://www.walmart.co.cr/porta-papel-mainstays-cromado/p
Pila Alcalina Duracell Blister AAA - 2 unidades,1.920,N/A,https://www.walmart.co.cr/pila-alcalina-duracell-blister-aaa-unidades/p
"Lija Aksi, De Agua Grano 120",275,N/A,https://www.walmart.co.cr/lija-de-agua-grano-120/p
"Boligrafo Faber Castell Medio 030 (3 Azul, 2 Negro, 1 Rojo) Blister 6 Unidades",900,N/A,https://www.walmart.co.cr/boligrafo-faber-castell-mediano-030-3a-2n-1r-b-unidades-4/p
"Bombillo Led Sylvania, 7W Luz blanca rosca E27 - 2 Uds",2.240,N/A,https://www.walmart.co.cr/2pk-led-a60-blanco-6-5w-slyvania-4/p
"Cinta de Regalo, Scotch, 19 mm x 12,7 m",2.000,N/A,https://www.walmart.co.cr/cinta-scotch-gift-wrap-12x127/p
Almacenador En Forma De Tomate,600,N/A,https://www.walmart.co.cr/almacenador-en-forma-tomate-5/p
Regleta Multiple Voltage con 2 puertos USB,3.800,N/A,https://www.walmart.co.cr/regleta-multiple-con-2-puertos-usb/p
Silla para playa Ozark Trail 5 position color negro -72 cm,17.90010.000,N/A,https://www.walmart.co.cr/silla-playa-ozark-t-5position-72cm-negra/p
Sabanas Hometrends 300 Hilos King Sea,19.90010.000,N/A,https://www.walmart.co.cr/sabanas-home-trends-300-hilos-king-sea-89-25nov24/p
Vasos Mainstays shots - 4 pack,750600,N/A,https://www.walmart.co.cr/vasos-mainstays-shots-4-pack/p
"Estuche Generica, Harry Potter",850200,N/A,https://www.walmart.co.cr/estuche-pequeno-harry-potter-con-espada/p
Basurero Better Homes Cromado Ovalado - 5L,7.6003.000,N/A,https://www.walmart.co.cr/basurero-better-homes-cromado-ovalado-5l/p
"Estuche Generica, Bare Bears",850200,N/A,https://www.walmart.co.cr/estuche-girls-bare-bears-2/p
"Estuche Generica, Bare Bears",1.300300,N/A,https://www.walmart.co.cr/estuche-girls-bare-bears/p
Toalla Playa Hometrends De Algodon,5.2003.500,N/A,https://www.walmart.co.cr/toalla-playa-hometrends-de-algodon/p
Almacenamiento Mainstays De Compartimentos 4x6,1.400500,N/A,https://www.walmart.co.cr/almacenamiento-mainstays-de-compartimentos-4x6/p
Basurero Better Homes Cromado Cuadrado - 15lt,19.60010.000,N/A,https://www.walmart.co.cr/basurero-better-homes-cromado-cuadra-15-lts-4/p
Sombrilla Home Trends con rayas azules y blancas,25.00015.900,N/A,https://www.walmart.co.cr/ht-sombrilla-rayas-azul-y-blanca-3m/p
Batería Duracell Alcalina 9 Voltios - 1 Unidad,4.1003.350,N/A,https://www.walmart.co.cr/bateria-duracell-alcalina-voltios-unidad/p
Hielera Igloo con rodines colores surtidos - 56 L,35.90029.900,N/A,https://www.walmart.co.cr/hielera-igloo-con-rodines-colores-surtidos-56-l/p
Caja Mainstays organizadora de tela -30x30x30 cm,1.950,N/A,https://www.walmart.co.cr/caja-organizadora-tela-30x30x30cm/p
Hervidor 11 Cm Mainstays,3.5002.900,N/A,https://www.walmart.co.cr/hervidor-11-cm-mainstays/p
Llanta Kumho para automóvil 195/60 Rin15,40.00034.500,N/A,https://www.walmart.co.cr/llanta-kumho-195-60r15/p
Batería Alcalina Rayovac AA - 4 Unidades,2.700,N/A,https://www.walmart.co.cr/bateria-alcalina-rayovac-aa-4u-4/p
Tenazas Expert Grill con agarre plástico,1.540,N/A,https://www.walmart.co.cr/tenazas-expert-grill-con-agarre-plastico-/p
Set De Sabanas Mainstays Individual Gris,6.500,N/A,https://www.walmart.co.cr/set-de-sabanas-mainstays-individual-gris/p
Silla Ozark Trail Luxury con brazos colores surtidos con capacidad de 136 kg,11.900,N/A,https://www.walmart.co.cr/silla-ozark-trail-luxury-con-brazos-136kg/p
Sobre Manila Buho Oficio N13 Paquete - 10 Unidades,950,N/A,https://www.walmart.co.cr/sobre-manila-buho-oficio-n13-paq10-4/p
Pintura Anticorrosivo de Acrílico Corona Fast Dry Color Mate Negro para Interior y Exterior -13.5 onzas,2.2001.800,N/A,https://www.walmart.co.cr/spray-corona-fast-dry-matt-negro/p
"Silla De Resina Infantil Mainstays, Color Rosa",12.900,N/A,https://www.walmart.co.cr/silla-resina-infantil-mainstays-color-rosa/p
Juego comedor Mainstays alto color café - 5 Pzas,299.900,N/A,https://www.walmart.co.cr/ms-set-comedor-alto-5-piezas-caf/p
Lápices Pen Gear de grafito -12 uds,650,N/A,https://www.walmart.co.cr/set-de-12lapices-de-grafito-negro/p
Vela Aromatica 8 Oz Pomelo Mangostino,1.900,N/A,https://www.walmart.co.cr/vela-aromatica-8-oz-pomelo-mangostino/p
Set 3Pcs Cucharas De Mesa Tramontina,1.850,N/A,https://www.walmart.co.cr/set-3pcs-cucharas-mesa-tramontina/p
Carrito Mainstays organizador infantil 3 compartimentos,6.410,N/A,https://www.walmart.co.cr/carrito-organizador-infantil-3-compartim/p
Toalla De Bano Haus Marron,1.8001.000,N/A,https://www.walmart.co.cr/toalla-de-bano-haus-marron/p
Escobilla Goodyear limpiaparabrisas  16 pulgadas,4.300,N/A,https://www.walmart.co.cr/escobilla-goodyear-limpiaparabrisas-16-pulgadas/p
Canasta Multiusos Con Gancho,600,N/A,https://www.walmart.co.cr/canasta-multiusos-con-gancho/p
Aromatizant Mini Gel Car Glade Aroma Odisea Azul - 70 g,1.460,N/A,https://www.walmart.co.cr/aromatizant-mini-gel-car-glade-aroma-odisea-azul-70-g/p
Set de herméticos Mainstays - 5 Pzas,1.700,N/A,https://www.walmart.co.cr/set-de-5-hermeticos-mainstays/p
Bolígrafos Stitch de gel con diseños,1.400,N/A,https://www.walmart.co.cr/stitch-4-boligrafos-con-disenos/p
Plato Mainstays  10.5 Pulg Porcelana Blanca,725,N/A,https://www.walmart.co.cr/plato-mainstays-10-5-pulg-porcelana-blanca-4/p
Canasta Mainstays plástica -2 L,600,N/A,https://www.walmart.co.cr/canasta-plastica-2l-mainstays/p
Llanta Delmax 175/70 r13 para automóvil - 1 Ud,22.500,N/A,https://www.walmart.co.cr/llanta-marca-delmax-17570r13/p
Almohada Mainstays Memory Foam,8.900,N/A,https://www.walmart.co.cr/almohada-mainstays-memory-foam/p
Sarten De Huevo Color Gris,2.500,N/A,https://www.walmart.co.cr/sarten-huevo-color-gris/p
Sabana Star Wars Matrimonial Micro Fibra,11.900,N/A,https://www.walmart.co.cr/star-wars-sabanas-matrimonial-microfibra/p
Set De Bowls Mainstays Para Mezclar - Unidad,2.000,N/A,https://www.walmart.co.cr/set-bowls-mainstays-para-mezclar-unidad/p
Edredón king Hotel Style mulberry - 4 Pzas,21.900,N/A,https://www.walmart.co.cr/edredon-king-hotel-style-mulberry-4-pzas/p
Canaston Guateplast para lavanderia con tapa 66 color beige - 1 Ud,4.200,N/A,https://www.walmart.co.cr/canaston-guateplast-lavanderia-con-tapa-2-beige-0-66lt/p
Ms Mesa De Centro Rectgular Vidrio 116cm,39.900,N/A,https://www.walmart.co.cr/ms-mesa-de-centro-rectgular-vidrio-116cm/p
"Funda Para Moto Auto Drive, Tamaño Xl 246x105x127cm",6.700,N/A,https://www.walmart.co.cr/funda-moto-xl-tamano246x105x127-cm/p
