Protector de Colchón impermeable Individual,11.900,N/A,https://www.walmart.co.cr/protector-de-colchon-impermeable-individual/p
Set 16 Cubiertos Plateados George Home,3.700,N/A,https://www.walmart.co.cr/set-16-cubiertos-plateados-george-home-76/p
Silla Ozark Trail Con Brazos Y Hielera Surtido Color 96.5cm - 136kg,12.900,N/A,https://www.walmart.co.cr/silla-ozark-t-oversize-mesh-brazos-96-5c/p
Recolector Mainstays De Cabello,900,N/A,https://www.walmart.co.cr/recolector-mainstays-de-cabello/p
Jabonera Mainstays De Cerámica,2.000,N/A,https://www.walmart.co.cr/jabonera-de-ceramica-mainstays-2/p
Masking Tape 48mm X 25 Metros,1.700,N/A,https://www.walmart.co.cr/masking-tape-48mm-x-25-metros/p
Encendedor Vox Night,410,N/A,https://www.walmart.co.cr/encendedor-vox-night-unidad-4/p
Set De Sabanas Mainstays Individual Azul,6.500,N/A,https://www.walmart.co.cr/set-de-sabanas-mainstays-individual-azul/p
Cortina Para Baños Mainstays Transparente,1.500,N/A,https://www.walmart.co.cr/cortina-para-banos-marca-mainstays-transparente/p
Canasta Home Dollar para prensas de ropa -24pzas,800,N/A,https://www.walmart.co.cr/canasta-prensas-para-ropa-24pz-2/p
Pila Panasonic Power Alcalina AAA Bl - 4 Unidades,2.800,N/A,https://www.walmart.co.cr/pila-panasonic-power-alcalina-aaa-bl-unidades-4/p
Escobita Dagostino Y Palita Princesa Automotriz,1.200,N/A,https://www.walmart.co.cr/escobita-y-palita-princesa-automotriz-4/p
Frasco Shandong ideal para el aceite con espacio para escribir,800,N/A,https://www.walmart.co.cr/vinagrera-con-tapa-metal-piz-shandong/p
Juego de torres Qred - 3 Uds,19.70017.000,N/A,https://www.walmart.co.cr/juego-de-torres-qred-3-uds/p
Termo Para Cafe Agarre Madera 1 L Ms,4.2002.500,N/A,https://www.walmart.co.cr/termo-para-cafe-agarre-madera-1-l-ms/p
"Mesa Mainstays Plegable Central De 20 X40Tamaño Del Producto (Cm): 1015X507X448,620,712MmTablero De Mesa Formado Al Vacío",18.90016.000,N/A,https://www.walmart.co.cr/mesa-mainstays-plegable-plastica-negra-101-5cm/p
Toldo plegable Ozark Trail color azul - 3 x 3 m,17.900,N/A,https://www.walmart.co.cr/toldo-plegable-ozark-trail-3x3-m-azul-4/p
Ht Contenedor Comida Mascotas 40L Tapa,9.0006.700,N/A,https://www.walmart.co.cr/ht-contenedor-comida-mascotas-40l-tapa-36-23dic24/p
Ms Consola De Vidrio 100cm,47.900,N/A,https://www.walmart.co.cr/ms-consola-de-vidrio-100cm/p
Alfombra Mainstays De Area Acanalada - 1 unidad,2.100,N/A,https://www.walmart.co.cr/alfombra-mainstays-area-acanalada-18x30cm-unidad/p
Set Mainstays de Pajillas Reutilizable de Metal con Cepillo - 5 piezas,990,N/A,https://www.walmart.co.cr/mainstays-set-pajilla-metal-5p-c-cepillo/p
Silicon Liquido Resistol - 100ml,900,N/A,https://www.walmart.co.cr/silicon-liquido-resistol-100ml/p
Perchero Mainstays para ropa de 2 niveles,11.500,N/A,https://www.walmart.co.cr/perchero-para-ropa-mainstays-niveles/p
Semillas Sol Naciente Tomillo,1.200,N/A,https://www.walmart.co.cr/semillas-marca-sol-naciente-tomillo/p
Basurero Uchosa Tapa Vaiven Surtido - 42 Litros,7.800,N/A,https://www.walmart.co.cr/basurero-uchosa-42l-tapa-vaiven/p
Cross Mainstays Tazas Medidoras 5 Piezas,1.000,N/A,https://www.walmart.co.cr/cross-mainstays-tazas-medidoras-5-piezas-4/p
Sustrato Ever Green Abono Orgánico- 5Lt,2.000,N/A,https://www.walmart.co.cr/evergreen-abono-jardin-organico-5lt/p
Canasta Para Ropa Rectangular,3.200,N/A,https://www.walmart.co.cr/canasta-para-ropa-rectangular/p
"Bombillo Incandescente Sylvania,100W Opaco rosca E27 -Und",670,N/A,https://www.walmart.co.cr/bombillo-sylvania-opaco-caja-100w-4/p
Bomba Destapacaños Aksi De Hule Con Mango,1.480,N/A,https://www.walmart.co.cr/bomba-marca-aksi-destapacanos-hule-con-mango/p
Sacapuntas Maped Plástico Con/Deposito 2 Huecos Shaker Unidad,350,N/A,https://www.walmart.co.cr/sacapuntas-maped-pla-c-d-2h-shaker-ud-4/p
Vaso Mainstays kids diseño niña - 370 ml,350200,N/A,https://www.walmart.co.cr/vaso-mainstays-kids-dise%C3%B1o-ni%C3%B1a-370-ml/p
Hielos de silicón Lilo & Stitch reutilizables,1.000700,N/A,https://www.walmart.co.cr/hielos-de-silicon/p
Cuaderno Pen Gear pride rayado - 150 hojas,2.300550,N/A,https://www.walmart.co.cr/cuaderno-marca-pen-gear-pride-150-hojas-5/p
Llanta Goodride 20555R16 - 1 ud,27.00024.000,N/A,https://www.walmart.co.cr/llanta-goodride-205-55r16-pr-rp28-91v/p
Cuaderno Doble Anillo Pasta Semi Dura Tamaño Profesional Multimateria,2.000650,N/A,https://www.walmart.co.cr/cuaderno-doble-o-pasta-sd-100h-pro-matte-4/p
Batería para carro LTH 550A 12V,107.00071.200,N/A,https://www.walmart.co.cr/bateria-para-carro-lth-550a-12v/p
Gas Vox butano para cocinas portátiles - 220 g,1.5501.350,N/A,https://www.walmart.co.cr/gas-butano-vox-220-gr/p
Silla Playera Mainstays textilene color beige,29.90023.900,N/A,https://www.walmart.co.cr/silla-mainstays-playera-textilene-beige/p
Ms Gabinete Rombos 30cm,5.900,N/A,https://www.walmart.co.cr/ms-gabinete-rombos-30cm/p
Set De Ganchos Para Ropa Mainstays 10 piezas,2.500,N/A,https://www.walmart.co.cr/set-de-10-ganchos-serchas-mainstays/p
Chorreador Madera Duran con Pie de Alambre Sin-Pintar - unidad,1.700,N/A,https://www.walmart.co.cr/chorreador-madera-duran-con-pie-alamb-sin-pintar/p
Batería Duracell Alcalina AA -  2 unidades,1.440,N/A,https://www.walmart.co.cr/bateria-duracell-alcalina-aa-2u-4/p
Carrito Mainstays organizador infantil 2 compartimentos,4.915,N/A,https://www.walmart.co.cr/carrito-organizador-infantil-2-compartim/p
Limpiador de vidrios Sabo para automóviles -  60 ml,750,N/A,https://www.walmart.co.cr/limpiador-sabo-para-parabrisas-60ml/p
Set Mainstays de Utensilios De Cocina - 4 piezas,1.500,N/A,https://www.walmart.co.cr/set-utensilios-cocina-mainstays-unidad-4/p
Tendedero Ropa Mainstays Con Alas Blanco,5.500,N/A,https://www.walmart.co.cr/tendedero-ropa-mainstays-con-alas-blanco-4/p
Tapasol Disney para auto modelo cars 160 x 70 cm,6.000,N/A,https://www.walmart.co.cr/tapasol-cars-160x70-cms-2/p
"Desinfectante Antibacterial Lysol Aerosol De Bolsillo, Para Superficies - 50ml",1.770,N/A,https://www.walmart.co.cr/desinfectante-marca-lysol-aerosol-on-the-go-50ml/p
Toalla De Mano Blanca Haus,650,N/A,https://www.walmart.co.cr/toalla-de-mano-blanca-haus/p
Cinta Karyma Transparente para Empaque 10 Yds - unidad,1.800,N/A,https://www.walmart.co.cr/cinta-transparente-p-empaque-10-yds/p
Cortina de baño Mainstays,2.500,N/A,https://www.walmart.co.cr/cortina-mainstays-peva-estampado-unidad/p
Alfombra Mainstays de grama artificial grande 1x2 - 1 Ud,10.000,N/A,https://www.walmart.co.cr/alfombra-mainstays-de-grama-artificial-1x2-mts/p
Cojín Gel Y Viscoelástico Auto Drive,7.000,N/A,https://www.walmart.co.cr/cojin-gel-y-viscoelasico-auto-drive/p
Taza Good Cook Medidora de Plástico 19864 - 1 Unidad,2.100,N/A,https://www.walmart.co.cr/taza-good-cook-medidora-plastico-19864-unidad/p
Funda Auto Drive Para Asiento Negro Y Gris,17.000,N/A,https://www.walmart.co.cr/funda-auto-drive-para-asiento-negro-y-gris/p
Cojin Decorativo Details Y Para Confort Abuela Liso - Unidad,19.500,N/A,https://www.walmart.co.cr/cojin-decorativo-details-y-para-confort-abuela-liso-unidad/p
Soporte Mainstays Para Papel Higiénico Negro,2.500,N/A,https://www.walmart.co.cr/soporte-mainstays-para-papel-higienico-negro-4/p
Set De Sábanas Mainstays Matrimonial Gris,7.500,N/A,https://www.walmart.co.cr/set-de-sabanas-mainstays-matrimonial-gris/p
Pegamento instantáneo Loctite super bonder extra fuerte - 3 g,2.990,N/A,https://www.walmart.co.cr/pegamento-instantaneo-loctite-super-bonder-extra-fuerte-3-g/p
Incienso Ganesha Palo Vainilla 20Pz Ea 1,1.000,N/A,https://www.walmart.co.cr/incienso-ganesha-palo-vainilla-20pz-ea-1-110/p
Limpia Vidrios Ebullient - 720Ml,2.500,N/A,https://www.walmart.co.cr/limpiavidrios-ebullient-p-auto-720-ml-2/p
Colador George Home Acero Inoxidable 18 cm,2.100,N/A,https://www.walmart.co.cr/colador-george-home-acero-inoxidable-18-cm/p
Filtro Reusable Good Cook Para Café 12477,1.700,N/A,https://www.walmart.co.cr/filtro-reusable-good-cook-para-cafe-12477/p
Recipiente Mainstays De Vidrio Con Seguro 310ml surtido - unidad,1.000,N/A,https://www.walmart.co.cr/recipiente-vidrio-con-seguro-310ml-ms/p
Canasta rectangular Guateplast 20 L de capacidad,2.500,N/A,https://www.walmart.co.cr/canasta-rectangular-20-l-guateplast-marfil-0/p
Tijera Scotch Multipropósito  - 1 Ud,2.000,N/A,https://www.walmart.co.cr/tijeras-multiproposito-scotch-8-pulgadas/p
Regleta Multiple De 5m,4.500,N/A,https://www.walmart.co.cr/regleta-multiple-de-5m/p
Sabanas Hometrends 300 Hilos Queen Blanca,17.50010.000,N/A,https://www.walmart.co.cr/sabanas-home-trends-300-hilos-queen-bca-84-25nov24/p
Frazada Jacquard 127x152 Cms,3.5002.000,N/A,https://www.walmart.co.cr/frazada-jacquard-127x152-cms/p
Caja Forte 3 Alta 11 Lts Rect 71550,3.8002.000,N/A,https://www.walmart.co.cr/caja-forte-3-alta-11-lts-rect-71550/p
Juego comedor Home Trends color café oscuro - 7 Pzas,299.900254.900,N/A,https://www.walmart.co.cr/ms-set-comedor-7p-cafe-oscuro/p
Rejilla Seca De Gran Tamano,7.6004.500,N/A,https://www.walmart.co.cr/rejilla-seca-de-gran-tamano/p
Cesto Mainstays de ropa doble con tapa - 1 Ud,8.7005.000,N/A,https://www.walmart.co.cr/cesto-de-ropa-doble/p
"Cartuchera Juvenil Yolo, color Fucsia Niña",3.500750,N/A,https://www.walmart.co.cr/cartuchera-juv-doble-compart-fucsia-nina/p
Cuaderno Doble Anillo Pasta Semi Dura Tamaño Profesional Multimateria,2.000650,N/A,https://www.walmart.co.cr/cuaderno-doble-o-pasta-sd-100h-pro-matte-11/p
Cuaderno Doble Anillo Pasta Semi Dura Tamaño Profesional Multimateria,2.000650,N/A,https://www.walmart.co.cr/cuaderno-doble-o-pasta-sd-100h-pro-matte-6/p
Colchón King Koil Brillo Tamaño Queen,315.000213.900,N/A,https://www.walmart.co.cr/colchon-marca-king-koil-queen-brillo/p
Colchón Luxor Tamaño individual doble pillow,149.000119.900,N/A,https://www.walmart.co.cr/luxor-colchon-individual-doble-pillow/p
Mueble Mainstays de almacenamiento con 4 gavetas -40x30x90 cm,9.500,N/A,https://www.walmart.co.cr/mueble-almacenamient-4gavetas-40x30x90cm/p
Set De 4 Vasos De 16 Oz 473 Ml,2.2001.500,N/A,https://www.walmart.co.cr/set-de-4-vasos-de-16-oz-473-ml-75-25nov24/p
Frazada Mainstays King - 1 Pza,8.600,N/A,https://www.walmart.co.cr/frazada-mainstays-king/p
Limpiador Super Jam De Llantas - 20oz,2.620,N/A,https://www.walmart.co.cr/sj-limpieza-espuma-limpiadora-llantas-super-jam/p
Maleta Bob Esponja Patricio Rosa,27.900,N/A,https://www.walmart.co.cr/maleta-20-patricio-rosada/p
Prensa Francesa 1 Lt,3.000,N/A,https://www.walmart.co.cr/prensa-francesa-1-lt/p
Almacenador Mainstays 4 Anaqueles Malla,7.500,N/A,https://www.walmart.co.cr/almacenador-mainstays-anaqueles-malla/p
Colador Mainstays plástico,700,N/A,https://www.walmart.co.cr/mainstays-set-colador-plastico/p
Colador 20 Cm Colapsable Hometrends,1.000,N/A,https://www.walmart.co.cr/colador-20-cm-colapsable-hometrends/p
Mesa plegable Lifetime a la mitad - 6 pies,31.500,N/A,https://www.walmart.co.cr/mesa-life-time-plegable-blanca-2/p
Carrito organizador Mainstays para microondas JX-20KF07,39.900,N/A,https://www.walmart.co.cr/carro-de-cocina-mainstays-para-microondas/p
Molde 12 Cubiletes Mainstays,2.200,N/A,https://www.walmart.co.cr/molde-12-cubiletes-mainstays/p
Porta Cubiertos Mainstays Con Tapa,2.200,N/A,https://www.walmart.co.cr/porta-cubiertos-mainstays-con-tapa-4/p
Pichel Mainstays Jumbo Plástico - 5lt,1.700,N/A,https://www.walmart.co.cr/pichel-mainstays-jumbo-plastico-5lt-4/p
Hielera Igloo Laguna 48 QT Color Azul,24.900,N/A,https://www.walmart.co.cr/hielera-igloo-laguna-48-qt-azul-4/p
Vaso Mainstays Kids Plástico Set -6 pzas,850,N/A,https://www.walmart.co.cr/mainstays-kids-vaso-plastico-set-6pcs/p
Atomizador Mainstays en spray con capacidad de 473 ml,1.200,N/A,https://www.walmart.co.cr/atomizador-mainstays-en-spray-con-capacidad-de-473-ml/p
Contenedor Mainstays  De Vidrio 1000ml,2.000,N/A,https://www.walmart.co.cr/contenedor-mainstays-de-vidrio-1000ml/p
Semillas Sol Naciente Romero,1.200,N/A,https://www.walmart.co.cr/semillas-marca-sol-naciente-romero/p
Cross Mainstays Espatula Ranurada,900,N/A,https://www.walmart.co.cr/cross-mainstays-espatula-ranurada-4/p
Sabanas Hometrends 300 Hilos King Grey,19.90010.000,N/A,https://www.walmart.co.cr/sabanas-home-trends-300-hilos-king-grey-97-25nov24/p
Mesa Mainstays auxiliar de resina acabado,6.5004.500,N/A,https://www.walmart.co.cr/ms-mesa-auxiliar-de-resina-acabado-negro/p
Organizador De Utensilios,2.000750,N/A,https://www.walmart.co.cr/organizador-de-utensilios-20-16ene25/p
Taza Hometrends de porcelana con tapa bambú -400 ml,1.3001.100,N/A,https://www.walmart.co.cr/taza-hometrends-de-porcelana-tapa-bamboo-400ml-20-31mar25/p
Mesas Home Trends estampado marmol - 3 Pzas,28.10021.900,N/A,https://www.walmart.co.cr/ms-set-de-3-mesas-acabado-marmol/p
"Cartuchera juvenil Yolo, color negro con estampados de colores",3.500750,N/A,https://www.walmart.co.cr/cartuchera-juv-doble-compart-neg-colores/p
"Estuche Generica, Chicas Super poderosas",1.300300,N/A,https://www.walmart.co.cr/estuche-girls-chicas-superpoderosas/p
Parrilla de gas Expert Grill 5 quemadores,230.000,N/A,https://www.walmart.co.cr/parrilla-gas-quemadores/p
Guantes de cuero Exprt Grill para BBQ -2 uds,4.590,N/A,https://www.walmart.co.cr/set-expert-grill-de-2guantes-para-bbq-de-cuero/p
Papelero Disney Lilo y Stitch -5500 ml,1.000,N/A,https://www.walmart.co.cr/papelero-5500ml-lilo-y-stitch/p
Cubo Mainstays organizador infantil,1.500,N/A,https://www.walmart.co.cr/cubo-organizador-infantil/p
Protector de Colchón impermeable Queen,15.200,N/A,https://www.walmart.co.cr/protector-de-colchon-impermeable-queen/p
Lámpara de mesa Home Trends con base de madera,11.000,N/A,https://www.walmart.co.cr/ht-lampara-de-mesa-con-base-madera/p
Cubo Mainstays organizador infantil,1.500,N/A,https://www.walmart.co.cr/cubo-mainstays-organizador-infantil-10-21mar25/p
Contenedor Lilo & Stitch de vdrio -920 ml,2.175,N/A,https://www.walmart.co.cr/contenedor-de-vidrio-lilo-stitch-920ml/p
Mesa Negra Plástica Plegable 122Cm,19.900,N/A,https://www.walmart.co.cr/mesa-negra-plastica-plegable-122cm/p
Maquina Para Hacer Tortilla Duran Madera  Redonda,3.000,N/A,https://www.walmart.co.cr/maq-p-tortill-red-mad-nat/p
Vajilla Mainstays de porcelana blanca - 12 Pzas,7.900,N/A,https://www.walmart.co.cr/vajilla-de-12pc-porcelana-blanca-mainsta/p
Basurero Guateplas Swing Pequeño con Tapa color Negro - 6lt,2.700,N/A,https://www.walmart.co.cr/basurero-swing-pequeno-c-tapa-6-l-guateplast-negro-0/p
Set Uchosa Gancho  color Blanco No.14 - 10 piezas,1.900,N/A,https://www.walmart.co.cr/set-gancho-uchosa-10pz-blanco-n14/p
Grapas Facela estándar punta de cincel - 5000 uds,550,N/A,https://www.walmart.co.cr/facela-caja-grapas-5000u-4/p
Mueble soporte para tv Mainstays colores surtidos JX-20KF06,74.900,N/A,https://www.walmart.co.cr/soporte-mainstays-tv-55-pulgadas/p
Paño De Secado Auto Drive De Pva -1 Unidad,3.000,N/A,https://www.walmart.co.cr/pano-secado-pva-auto-drive/p
Alfombra Mainstays Masajeadora,3.600,N/A,https://www.walmart.co.cr/alfombra-mainstays-masajeadora/p
Zapatera Mainstays Metal 10 Niveles - 1 Unidad,16.900,N/A,https://www.walmart.co.cr/zapatera-mainstays-metal-10-niveles-unidad-4/p
Escurridor De Platos Mainstays,4.200,N/A,https://www.walmart.co.cr/escurridor-de-platos-mainstays/p
Sarten George Home - 20 cm,5.200,N/A,https://www.walmart.co.cr/sarten-george-home-20-cm/p
Escurridor Doble Piso Charola Plastico,8.000,N/A,https://www.walmart.co.cr/escurridor-doble-piso-charola-plastico-24/p
Espatula Mainstays Azul - Unidad,700,N/A,https://www.walmart.co.cr/espatula-mainstays-azul-unidad/p
Caja Organizadora Home Pro Con Cierre - 57lt,6.100,N/A,https://www.walmart.co.cr/caja-organizadora-home-pro-con-cierre-57lt/p
Abrelatas Oster Yorkville,2.500,N/A,https://www.walmart.co.cr/abrelatas-yorkville-oster/p
Marcador Artline 107 permanente negro,600,N/A,https://www.walmart.co.cr/marcador-artline-107-permanente-negro-4/p
Tierra Rica Tierra Vitaminada - 5 lt,1.500,N/A,https://www.walmart.co.cr/tierra-rica-tierra-vitaminada-lt/p
Semillas Hierba Para Gatos Sol Naciente,1.550,N/A,https://www.walmart.co.cr/semillas-hierba-para-gatos-marca-sol-naciente/p
Cross Mainstays Espatula De Silicón Con Mango,1.400,N/A,https://www.walmart.co.cr/cross-mainstays-espatula-de-silicon-con-mango-4/p
Aromatizante de repuesto Glade auto sport nueva fragancia - 7 ml,5.000,N/A,https://www.walmart.co.cr/auto-glade-sport-repuesto-auto-nuevo-7ml-4/p
Semillas Albahaca Sol Naciente,1.030,N/A,https://www.walmart.co.cr/semillas-albahaca-marca-sol-naciente/p
Candela Candle Tea Lights Sin Aroma X 10 Unidad,1.500,N/A,https://www.walmart.co.cr/candela-tea-lights-sin-aroma-x-10-unidad-4/p
Abre Lata Mainstays,1.500,N/A,https://www.walmart.co.cr/abre-lata-mainstays/p
Sabanas Hometrends 300 Hilos Full Beige,15.70010.000,N/A,https://www.walmart.co.cr/sabanas-home-trends-300-hilos-full-beige-91-25nov24/p
Llanta Winda Wh16 - 195/50R15,25.00021.200,N/A,https://www.walmart.co.cr/llanta-195-50r15-wh16-winda-4/p
Cuaderno Doble Anillo Pasta Semi Dura Tamaño Profesional Multimateria,2.000650,N/A,https://www.walmart.co.cr/cuaderno-doble-o-pasta-sd-100h-pro-matte-9/p
Hidrolavadora Auto Drive 1400 PSI,52.00041.000,N/A,https://www.walmart.co.cr/hidrolavadora-autodrive-1400-psi/p
Sarten Ilko Antiad Just Cook  20 Cm,3.8002.000,N/A,https://www.walmart.co.cr/sarten-ilko-antiad-just-cook-20-cm/p
Mueble Mainstays de almacenamiento con 2 gavetas -40x30x47.5  cm,6.000,N/A,https://www.walmart.co.cr/mueble-almacenam-2-gavetas-40x30x47-5cm/p
Colchón marca Luxor Tamaño Matrimonial Doble Pillow,185.000147.900,N/A,https://www.walmart.co.cr/luxor-colchon-matrimonial-doble-pillow/p
Cuaderno Pen+ Gear pasta semidura 300 páginas rayadas,2.300550,N/A,https://www.walmart.co.cr/cuaderno-marca-pen-gear-pride-150-hojas-7/p
Cesta Para Ropa Con Ruedas Y Asa 60l. Ms,7.1005.700,N/A,https://www.walmart.co.cr/cesta-para-ropa-con-ruedas-y-asa-60l-ms/p
Llanta Goodride 195/50 R15 Rp28,24.50021.800,N/A,https://www.walmart.co.cr/llanta-goodride-195-50-r15-rp28/p
Mesa Mainstays para niños con 2 sillas,37.900,N/A,https://www.walmart.co.cr/ms-mesa-para-ninos-con-2-sillas/p
Pegamento Instantáneo Loctite Super Bonder Precisión - 5g,3.1002.500,N/A,https://www.walmart.co.cr/loctite-super-bonder-presici-n-5g/p
"Pintura acrilica Lanco 4 años de garantía, Color Place blanco pastel",3.900,N/A,https://www.walmart.co.cr/color-place-blanco-pastel-cuarto/p
Set 2 Tablas Picar Stitch Pp 41 X 21Cm,1.360750,N/A,https://www.walmart.co.cr/set-2-tablas-picar-stitch-pp-41-x-21cm-32-17feb25/p
Cinta Scotch Transparente - 1Ud,700,N/A,https://www.walmart.co.cr/cinta-en-bolsa-scotch-500-transparente-18mm-x-25m/p
Librera inclinada 5 divisiones Mainstays color cafe,29.500,N/A,https://www.walmart.co.cr/librera-mainstays-divisiones-inclinada-color-cafe-unidad/p
Silla gamer Mainstays colores surtidos MLM611386,70.000,N/A,https://www.walmart.co.cr/silla-mainstays-gamer-racing-roja-300mm-2/p
Cocina JumboStar Portátil y Camping de Gas,16.500,N/A,https://www.walmart.co.cr/cocina-gas-jumbo-portatil/p
Tenazas George Home De Cocina  - Unidad,1.200,N/A,https://www.walmart.co.cr/tenazas-george-home-cocina-unidad/p
Almohada Mainstays blanca estándar  cómoda y suave,4.500,N/A,https://www.walmart.co.cr/almohada-blanca-estandar-mainstays/p
Silla Ozark Trail con brazos colores surtidos con capacidade de 100 kg,7.700,N/A,https://www.walmart.co.cr/silla-ozark-trail-para-camping-con-mesh-4/p
Cuaderno Scribe de resortes -150 hojas,1.700,N/A,https://www.walmart.co.cr/cuaderno-steno-kraft-scribe-espiral-150h/p
Hojas Sauter Papel Bond 75 Gramos Carta Paquete/100 Hojas,950,N/A,https://www.walmart.co.cr/hojas-sauter-blanca-carta-bond-75g-p100-4/p
Cuaderno Nottas Pro Logo Gryffindor 3 Materias - 120 Hojas,1.000,N/A,https://www.walmart.co.cr/cuaderno-nottas-oo-pro-120h-3-mat-harry-pot-sur-6/p
"Edredón Queen/Full Hotel Style, color verde -5 pzas",24.900,N/A,https://www.walmart.co.cr/edredon-queenfull-hotel-style-color-verde-5-pzas/p
Caja Organizadora Soluc Mainstays 18L,3.300,N/A,https://www.walmart.co.cr/caja-organizadora-soluc-mainstays-18l/p
Molde Mainstays Para Pan - Unidad,1.200,N/A,https://www.walmart.co.cr/molde-mainstays-para-pan-unidad/p
"Set Toallas Auto Drive, Microfibra 4 piezas",1.100,N/A,https://www.walmart.co.cr/set-toallas-auto-drive-microfibra-4piezas-04feb25/p
Pretul Manguera 2 Capas Flexble 10M Azul,5.300,N/A,https://www.walmart.co.cr/pretul-manguera-capas-flexble-10m-azul-4/p
Vaso Liso 504 Vidrio Santos 325 Ml,500,N/A,https://www.walmart.co.cr/vaso-liso-504-vidrio-santos-325-ml-4/p
Maceta Rattan N1,1.100,N/A,https://www.walmart.co.cr/maceta-rattan-n1/p
"Mini Ganchos Command, Transparentes",2.200,N/A,https://www.walmart.co.cr/gancho-command-mini-llaves-transparente-unidad/p
Cinta Pen Gear Adhesiva - 5 pzas,850,N/A,https://www.walmart.co.cr/cinta-adhesiva-pengear-transparente-5-piezas-modelo-mp55774-4/p
Refrigerante Coolant Ebullient antifreeze - 4.1 L,2.300,N/A,https://www.walmart.co.cr/refrigerante-coolant-ebullient-4100-ml/p
Olla Mainstays Con Tapa Color Negra - 24 Cm,6.500,N/A,https://www.walmart.co.cr/olla-mainstays-con-tapa-color-negra-24-cm/p
Cross -Gelatineros (5.7 Oz/185 Ml)  Guateplast Pa  Gelatina /Set 4 Surtido 0,1.000,N/A,https://www.walmart.co.cr/cross-gelatineros-5-7-oz-185-ml-guateplast-pa-gelatina-set-surtido-0/p
Meguiars Eliminador De Olores New Car,9.990,N/A,https://www.walmart.co.cr/meguiars-eliminador-olores-new-car-2/p
Set Guatplast de Bandejas Para Hielo Blanco -  2 unidades,1.500,N/A,https://www.walmart.co.cr/bandeja-guateplast-para-hielo-blanco-0-set-2/p
Recipiente Mainstays Grande De Vidrio Con Seguro,2.300,N/A,https://www.walmart.co.cr/recipiente-vid-c-seguro-mainstays-gde/p
Plato Zibo de vidrio,800,N/A,https://www.walmart.co.cr/plato-marca-zibo-vidrio/p
Frasco Shandong de vidrio con tapa,800,N/A,https://www.walmart.co.cr/canister-con-forma-gota-shandong-2/p
"Folders Mya, de colores -10 uds",1.200,N/A,https://www.walmart.co.cr/folder-buho-carta-surt-color-paquete-10-unidades-4/p
Candela Tealight Blanc Duni Set 10 U 210,980,N/A,https://www.walmart.co.cr/candela-tealight-blanc-duni-set-10-u-210/p
"Paraguas Simply Basic, Largo Surtido",4.9002.000,N/A,https://www.walmart.co.cr/paraguas-simply-basic-largo/p
Taza Haus Cerámica Surtido -12 oz,550300,N/A,https://www.walmart.co.cr/hs-taza-de-ceramica-embosada-12onz/p
Hielera Ozark Trail Bolsa Suave 24 Latas,9.9006.000,N/A,https://www.walmart.co.cr/hielera-bolsa-ozark-trail-suave-24-latas-7-17ene25/p
Sartén George Home forjado antiadherente -28 cm,4.9003.000,N/A,https://www.walmart.co.cr/sarten-george-home-forjado-antiadherente-28-cm/p
Set parrillero Expert Grill acero inoxidable - 3 Pzas,5.5002.007,N/A,https://www.walmart.co.cr/set-parrillero-expert-grill-acero-inoxidable-3-pzas/p
Cojín Mainstays cuadrado - 40x40 cm.,3.5002.500,N/A,https://www.walmart.co.cr/cojin-mainstays-cuadrado-40x40-cm-/p
Sillón Home Trends individual color café,164.900139.900,N/A,https://www.walmart.co.cr/ht-sillon-recli-ind-cafe-84-5x91-5x101-5/p
Llanta 18565R14 Wp15 Winda,23.90020.300,N/A,https://www.walmart.co.cr/llanta-18565r14-wp15-winda/p
Silla De Playa Ozark Trail Surtido Color 74cm - 80kg,7.5005.500,N/A,https://www.walmart.co.cr/silla-para-playa-ozark-trail-basica-74cm/p
"Cartuchera Juvenil Yolo, color azul Niña",3.500750,N/A,https://www.walmart.co.cr/cartuchera-juv-doble-compart-azul-nina/p
Cuaderno Doble Anillo Pasta Semi Dura Tamaño Profesional Multimateria,2.000650,N/A,https://www.walmart.co.cr/cuaderno-doble-o-pasta-sd-100h-pro-matte-8/p
Vajilla Brist Gols 12 Pz,11.9008.000,N/A,https://www.walmart.co.cr/vajilla-brist-gols-12-pz/p
Plato Mainstays surtido,350200,N/A,https://www.walmart.co.cr/ms-plato-cena-10-5/p
Gazebo Home Trends 3x3  color beige con paredes,155.000120.000,N/A,https://www.walmart.co.cr/gazebo-home-trends-3x3-color-beige-con-paredes-/p
Silla Gamer Mainstays color negro con masajeador,49.900,N/A,https://www.walmart.co.cr/ms-silla-gamer-negra-con-masajeador/p
Sofa Cama Mainstays Con Patas De Plástico,114.900,N/A,https://www.walmart.co.cr/sofa-cama-mainstays-con-patas-de-plastico/p
Incienso Ganesha Limon 20pz Ea 1,1.000,N/A,https://www.walmart.co.cr/incienso-ganesha-limon-20pz-ea-1/p
Sobre Manila Buho Carta N10 Paquete - 10 Unidades,800,N/A,https://www.walmart.co.cr/sobre-manila-buho-carta-n10-paquete-10-unidades/p
Plaguicida Líquido Ever Green Multiacción Orgánico - 750Ml,4.500,N/A,https://www.walmart.co.cr/multiaccion-evergreen-doy-pack/p
Organizador Infantil Mainstays tipo librera,27.900,N/A,https://www.walmart.co.cr/ms-organizador-infantil-tipo-librera/p
Marcadores Pen Gear para pizarrón con borrador - 5 pzas,850,N/A,https://www.walmart.co.cr/pen-gear-marcadores-papa-pizarra/p
Edredón Individual Mainstays estrellas,13.500,N/A,https://www.walmart.co.cr/edredon-mainstays-set-3-piezas-size-individual-2/p
Cinta Scotch Magica Dispensador - 1Ud,3.750,N/A,https://www.walmart.co.cr/cinta-scotch-magica-con-dispensador-19-mm-20m/p
Gancho Command Transparente Mediano - 2 Uds,3.100,N/A,https://www.walmart.co.cr/command-ganchos-transparentes-medianos/p
Maleta Star Wars color blanco No.20,23.900,N/A,https://www.walmart.co.cr/maleta-no20-star-wars-blanco-18/p
Batería para auto LH 51r 500 amp 12 v BATAUTLH007,92.00060.800,N/A,https://www.walmart.co.cr/bateria-lth-51r-500-amp-12v-4/p
Cuaderno Pen-Gear universitario pasta dura color celeste - 200 hojas,2.300550,N/A,https://www.walmart.co.cr/cuaderno-marca-pen-gear-pride-150-hojas-6/p
Colchón Confort life  Tamaño Queen doble boxtop,179.900,N/A,https://www.walmart.co.cr/confort-life-colchon-queen-doble-boxtop/p
Parrilla Expert Grill a carbón y a gas con 3 quemadores,230.000,N/A,https://www.walmart.co.cr/parrilla-expert-grill-a-carbon-y-a-gas-con-3-quemadores/p
Colchón King Koil Tamaño Queen resplandor,269.000,N/A,https://www.walmart.co.cr/colchon-marca-king-koil-queen-resplandor/p
Silla Mainstays plegable,5.900,N/A,https://www.walmart.co.cr/msk-silla-plegabl-infant-36-39-57gris/p
