Colchón Jiron Econo Plus Matrimonial Ortopédico,195.900145.900,N/A,https://www.walmart.co.cr/colchon-matrimonial-jiron-economico-plus-unidad/p
Colchón Jiron Confortico Individual Ortopédico,99.50077.900,N/A,https://www.walmart.co.cr/colchon-confortico-jiron-individual/p
Base Para Colchón JIRON Matrimonial,82.500,N/A,https://www.walmart.co.cr/jiron-base-matrimonial/p
Bolsa Verde Grande Reutilizable,700,N/A,https://www.walmart.co.cr/bolsa-verde-grande-reutilizable-4/p
Colchón Luxor Top Confort Tamaño Individual,119.90075.900,N/A,https://www.walmart.co.cr/luxor-colchon-individual-top-confort/p
Colchón Jiron Platinum Plus Matrimonial Ortopédico,153.900129.900,N/A,https://www.walmart.co.cr/colchon-jiron-matrimonial-platinum-plus/p
Colchón Jiron Econo Plus Queen Ortopédico,243.900179.900,N/A,https://www.walmart.co.cr/jiron-colchon-queen-econo-plus/p
Colchón Luxor Tamaño Matrimonial top confort,139.90089.900,N/A,https://www.walmart.co.cr/colch-n-top-confort-matrimonial-luxor/p
Colchón Jiron Platinum Individual Ortopédico,115.90097.900,N/A,https://www.walmart.co.cr/colchon-jiron-individual-platinum/p
Resma De Papel Chamex Carta 98 Blancura,1.900,N/A,https://www.walmart.co.cr/resma-papel-chamex-carta-98-blancura/p
Fosforos Suli De Madera - 10 Cajitas,320,N/A,https://www.walmart.co.cr/fosforos-suli-de-madera-10-cajitas/p
Botella Home Pro Atomizador - 550ml,1.200,N/A,https://www.walmart.co.cr/botella-atomizador-home-pro-550-ml/p
Colchón Luxor Tamaño Matrimonial full confort,165.900119.900,N/A,https://www.walmart.co.cr/luxor-colchon-matrimonial-full-confort/p
Colchón Jiron Matrimonial confortico,131.90099.900,N/A,https://www.walmart.co.cr/colchon-jiron-matrimonial-confortico/p
Bolsa Elena para Chorrear Café -unidad,550,N/A,https://www.walmart.co.cr/cross-bols-chorr-caf-elena-gde/p
Armario Keter space winner alto 72 cm,122.000,N/A,https://www.walmart.co.cr/armario-space-winner-alto-72-cms/p
Maleta Disney Silueta Mickey Rosada Pequeña - 1 Ud,35.900,N/A,https://www.walmart.co.cr/maleta-disney-silueta-mickey-rosada-peque%C3%B1a-1-ud/p
Colchón marca Luxor Tamaño Individual Full Confort,143.900,N/A,https://www.walmart.co.cr/luxor-colchon-individual-full-confort/p
Librera Mainstays 5 divisiones color negro MS89-010-092-41,34.900,N/A,https://www.walmart.co.cr/ms-librera-divisiones-c-true-black-oak/p
"Bombillo Led Sylvania, 12W Luz Blanca rosca E27 -3 uds",3.200,N/A,https://www.walmart.co.cr/3-pack-bombillo-sylvania-led-12w-luz-blanca/p
Tierra Rica Tierra Vitaminada - 10 lt,2.250,N/A,https://www.walmart.co.cr/tierra-rica-tierra-vitaminada-10-lt/p
Batería Duracell Alcalina AA Basico - 4unidades,3.4202.750,N/A,https://www.walmart.co.cr/bateria-duracell-alcalina-aa-basico-4unidades-4/p
Colchón Jiron Queen hibrydo 360 pocket,255.000199.900,N/A,https://www.walmart.co.cr/jiron-colchon-queen-hibrydo-360-pocket/p
Silla plegable Ozark Trail con brazos colores surtidos 81 cm con capacidad de 102 kg,5.700,N/A,https://www.walmart.co.cr/silla-ozark-trail-negro-81-cms/p
Ducha Lorenzetti Maxi Ultra 127v 5500w modelol 7537641 - unidad,18.610,N/A,https://www.walmart.co.cr/ducha-lorenzetti-maxi-ultra-blanca-127v-4/p
Batería Panasonic Zinc Carbon AAA - 4 Unidades,1.460,N/A,https://www.walmart.co.cr/bateria-panasonic-zinc-carbon-aaa-unidades/p
Tijera Cocina Mainstays,600,N/A,https://www.walmart.co.cr/tijera-cocina-mainstays-4/p
Pesa Digital Mainstays Para Cocina - 1 Unidad,4.500,N/A,https://www.walmart.co.cr/pesa-digital-para-cocina/p
Colchón Confort Life tamaño matrimonial special edition,224.900,N/A,https://www.walmart.co.cr/colchon-matrimonial-special-edition/p
Matamoscas GuatePlast para las Moscas surtido - unidad,570,N/A,https://www.walmart.co.cr/cross-matamoscas-pa-las-moscas-guateplast-surtido-0-4/p
"Colchón Marca Luxor Tamaño King, Full Confort",235.900161.900,N/A,https://www.walmart.co.cr/luxor-colchon-king-full-confort/p
Cepillo para inodoro Mainstays con base gris,1.200,N/A,https://www.walmart.co.cr/cepillo-para-inodoro-mainstays-con-base-gris/p
Sofá cama Mainstays deluxe base dorada,130.90099.900,N/A,https://www.walmart.co.cr/ms-sofa-cama-deluxe-base-dorada/p
Lámpara Mainstays de pie decorativa,9.900,N/A,https://www.walmart.co.cr/lampara-pie-decorativa-mainstays/p
"Lonchera termica Yolo, estampado de unicornio color morado",5.0001.000,N/A,https://www.walmart.co.cr/lonchera-termica-negro-con-estampados/p
Colchón Jiron Matrimonial hibrydo 360 pocket,229.000179.900,N/A,https://www.walmart.co.cr/jiron-colchon-matri-hibrydo-360-pocket/p
Colchón marca Kingkoil Tamaño Matrimonial Resplandor,227.000,N/A,https://www.walmart.co.cr/colchon-marca-king-koil-matrimonial-resplandor/p
Colchón Luxor Tamaño Queen full confort,209.900,N/A,https://www.walmart.co.cr/luxor-colchon-queen-full-confort/p
Tabla Maintays Para Picar Bambu - Unidades,1.800,N/A,https://www.walmart.co.cr/tabla-maintays-para-picar-bambu-unidades/p
Batería Panasonic Zinc Carbon AA - 4 Unidades,1.550,N/A,https://www.walmart.co.cr/bateria-panasonic-zinc-carbon-aa-unidades-4/p
Colchón Serta Tamaño Matrimonial Perfect Balance Medio,289.900151.900,N/A,https://www.walmart.co.cr/serta-colchon-matri-perfectbalance-medio/p
Cepillo para inodoro Mainstays con base blanco - 2 Pzas,1.200,N/A,https://www.walmart.co.cr/cepillo-para-inodoro-mainstays-con-base-blanco-2-pzas/p
Batería Rayovac Alcalina AAA - 6 Unidades,3.640,N/A,https://www.walmart.co.cr/bateria-rayovac-alcalina-aaa-unidades-5/p
Vasos de vidrio Mainstays altos 4 uds -450 ml,2.9002.000,N/A,https://www.walmart.co.cr/ms-set-de-4-vasos-altos-de-vidrio-450ml/p
Copas de vidrio Mainstays para vino 4 uds -470 ml,2.9002.000,N/A,https://www.walmart.co.cr/ms-set-de-4-copas-de-vidrio-vino-470ml/p
Almohada Haus hipoalergénica 40 x 60 cm,2.000,N/A,https://www.walmart.co.cr/planta-marca-mainstays-artificial-maceta-plastico-60cm-119/p
Bateria Alcalinas AA Work Tools 6 Pack,800,N/A,https://www.walmart.co.cr/bateria-alcalinas-aa-marca-work-tools-6-pack/p
Ms Bar Bajo Fraktal 95cm Alto,94.90083.900,N/A,https://www.walmart.co.cr/ms-bar-bajo-fraktal-95cm-alto/p
Aspiradora Auto Drive para automóvil,11.0007.800,N/A,https://www.walmart.co.cr/aspiradora-auto-drive-para-automovil-/p
Colchon Luxor Matrimonial Sele,181.900,N/A,https://www.walmart.co.cr/luxor-colchon-ee-sele-matri/p
Tapasol Disney para auto modelo cars 160 x 70 cm,6.000,N/A,https://www.walmart.co.cr/tapasol-cars-160x70-cms/p
Alfombra para baño Mainstays colores surtidos 40 x 60 cm,1.900,N/A,https://www.walmart.co.cr/alfombra-para-ba%C3%B1o-mainstays-colores-surtidos-40-x-60-cm/p
Escurridor De Platos 2 Niveles Mainstays,5.900,N/A,https://www.walmart.co.cr/escurridor-de-platos-2-niveles-mainstays/p
Parrilla de carbón Expert Grill de Hierro fundido con 2 estantes deslizantes  -32 pulgadas,134.000107.000,N/A,https://www.walmart.co.cr/parrilla-marca-expertgrill-deluxegrande-de-carbon/p
Maleta Disney Carita Minnie Negra Pequeña - 1 Ud,35.900,N/A,https://www.walmart.co.cr/maleta-disney-carita-minnie-negra-peque%C3%B1a-1-ud/p
Caja Home Pro Uso Pesado De 102 Ltrs.,8.500,N/A,https://www.walmart.co.cr/caja-home-pro-uso-pesado-de-102-ltrs/p
"Lonchera termica Yolo, estampado de corazones color rosado",5.0001.000,N/A,https://www.walmart.co.cr/lonchera-termica-azul/p
"Silla Plegable Ozark Trail Con Mesa Para Lata Surtido Color 80.7cm, 31cm - 136kg",11.9009.900,N/A,https://www.walmart.co.cr/silla-para-camping-director-ozark-trail-unidad/p
Colchón Queen confort life edición especial,249.900,N/A,https://www.walmart.co.cr/colchon-queen-confort-life-edicion-especial/p
Colchón confort life king edición especial,319.900,N/A,https://www.walmart.co.cr/colchon-confort-life-king-edicion-especial/p
Maleta Star Wars color negro 20 pulgadas,23.900,N/A,https://www.walmart.co.cr/maleta-no20-star-wars-negro-82/p
Carbón Great Value Briquetas Bolsa 5kg,5.7004.890,N/A,https://www.walmart.co.cr/great-value-briquetas-carbon-bolsa-kg/p
Atomizador Pequeño (16 Oz/475 Ml) Natural 0,1.340,N/A,https://www.walmart.co.cr/atomizador-pequeno-16-oz-475-ml-natural-0-4/p
Papel Bond Tamano Carta Facela,1.950,N/A,https://www.walmart.co.cr/papel-bond-tamano-carta-facela/p
Colchón Confort life Tamaño Queen diamante,219.900197.900,N/A,https://www.walmart.co.cr/confort-life-colchon-queen-diamante/p
Espejo Home Trends cuerpo entero arco dorado 142 cm,15.000,N/A,https://www.walmart.co.cr/ht-espejo-cuerpo-entero-arco-dorad-142cm/p
Bateria Rayovac Zinc Carbon AAA - 4 Unidades,1.350,N/A,https://www.walmart.co.cr/bateria-rayovac-zinc-carbon-aaa-unidades/p
Hielera Ozark Trail Suave 50 Latas Color Azul - 41cm,11.500,N/A,https://www.walmart.co.cr/hielera-ozark-trail-suave-50-latas/p
Colchón marca Kingkoil Tamaño Individual Resplandor,182.000,N/A,https://www.walmart.co.cr/colchon-marca-king-koil-individual-resplandor/p
Set Cubiertos De Mesa 16 Pc Mainstays,3.700,N/A,https://www.walmart.co.cr/set-cubiertos-de-mesa-16-pc-mainstays-73/p
Prensas Mainstays De Ropa Silicon -20 piezas,1.200,N/A,https://www.walmart.co.cr/prensas-mainstays-ropa-silicon-20-piez-4/p
Pinchos Expert Grill de bamboo -12 pulgadas,600377,N/A,https://www.walmart.co.cr/pinchos-bacyard-grill-bamboo-12-pulgadas-4/p
Carbon El Roble bolsa - 2 kg,2.400,N/A,https://www.walmart.co.cr/carbon-el-roble-bolsa-2-kg/p
Caja Organizadora Mainstays Acrílico,1.200,N/A,https://www.walmart.co.cr/caja-organizadora-mainstays-acrilico/p
Mueble Mainstays de almacenamiento con 3 gavetas -40x30x69 cm,7.890,N/A,https://www.walmart.co.cr/mueble-almacenam-3-gavetas-40x30x69cm/p
Batería Duracell Alcalina AAA - 4 Unidades,3.4202.750,N/A,https://www.walmart.co.cr/bateria-duracell-alcalina-aaa-unidades/p
"Silla Ozark Trail, gravedad cero -112cm",22.900,N/A,https://www.walmart.co.cr/silla-acolchada-ozark-trail/p
Colchón Kingkoil Queen Ee 1bts Verano,123.805,N/A,https://www.walmart.co.cr/kingkoil-queen-ee-1bts-verano/p
Zapatera Mainstays 2 Niveles Expandible - Unidad,5.000,N/A,https://www.walmart.co.cr/zapatera-mainstays-niveles-expandible-unidad-5/p
Dispensador On Carga De Jabón Líquido Con Esponja,7.500,N/A,https://www.walmart.co.cr/dispensador-on-carga-de-jabon-liquido-con-esponja/p
Goma en barra Faber Castell -40g,750,N/A,https://www.walmart.co.cr/goma-en-barra-faber-castell-40-grs/p
Pelador Verduras Mainstays - Unidad,520,N/A,https://www.walmart.co.cr/pelador-verduras-mainstays-unidad/p
Chispa Enciende Fuego Caja Con 6 Unidades,1.880,N/A,https://www.walmart.co.cr/chispa-enciende-fuego-un-caja-1x24-4/p
Batería Rayovac Alcalina AA - 6 Unidades,3.640,N/A,https://www.walmart.co.cr/bateria-alcalina-rayovac-aa-unidades-4/p
Tendedero Mainstays Con Alas Y Perchero - Unidad,14.0007.000,N/A,https://www.walmart.co.cr/tendedero-mainstays-con-alas-y-perchero-unidad/p
Colchón Confort Life tamaño king diamante,259.900,N/A,https://www.walmart.co.cr/confort-life-colchon-king-diamante/p
Sofá cama Mainstays futon convertible,189.900,N/A,https://www.walmart.co.cr/sofa-cama-marca-mainstays-futon-convertible/p
Librero Mainstays con 3 divisiones color negro,20.500,N/A,https://www.walmart.co.cr/librera-mainstays-divisiones-true-black-oak-4/p
Basurero Mainstays acero inoxidable capacidad 3 L,4.900,N/A,https://www.walmart.co.cr/basurero-mainstays-acero-inoxidable-3-litros/p
Maquina Para Tortillas Obando Aluminio Fundido Ref - Pequeña,5.850,N/A,https://www.walmart.co.cr/maquina-para-tortillas-obando-aluminio-fundido-ref-pequena/p
Set Mainstays  de Prensas Acero - 12 piezas,650,N/A,https://www.walmart.co.cr/set-12-prensas-acero-mainstays-4/p
Dispensador Para Mayordomo,1.200,N/A,https://www.walmart.co.cr/dispensador-para-mayordomo-42/p
Clips Para Bolsas,1.300,N/A,https://www.walmart.co.cr/clips-para-bolsas-211-20nov24/p
"Set Guataplast de Embudos Para Llenar, Surtido - unidad",750,N/A,https://www.walmart.co.cr/cross-set-embudos-pa-llenar-guateplast-surtido-0-4/p
Bowl para niños Lilo & Stitch divertido y colorido,850450,N/A,https://www.walmart.co.cr/bowl-para-ninos/p
Protector de Colchón impermeable Matrimonial,14.700,N/A,https://www.walmart.co.cr/protector-de-colchon-impermeable-matrimonial/p
Baterías Duracell Botón De Litio 2032 x2,3.770,N/A,https://www.walmart.co.cr/baterias-duracell-boton-de-litio-2032-x2/p
Espejos M036 Colores 33X124.9 Exhibidor,7.500,N/A,https://www.walmart.co.cr/espejos-m036-colores-33x124-9-exhibidor/p
Tijeras De Cocina George Home,800,N/A,https://www.walmart.co.cr/tijeras-cocina-george-home/p
Tina Uchosa Plastica Redonda - 40lt,3.800,N/A,https://www.walmart.co.cr/tina-plastica-uchosa-40l-redonda/p
Encendedor Atomic Básico -5 gr,470,N/A,https://www.walmart.co.cr/encendedor-atomic-basico-5-gr/p
"Recipiente Mainstays, de vidrio -1000ml",3.2002.000,N/A,https://www.walmart.co.cr/recipiente-marca-mainstays-vidrio-con-divisiones-y-cubiertos-1000ml/p
Salero Clásico Guateplast Tapa Roscada Blanco,370,N/A,https://www.walmart.co.cr/salero-clasico-c-tapa-roscada-tr-guateplast-blanco-0-4/p
Tierra Rica Enriquesida Vitaminada - 22lt,4.800,N/A,https://www.walmart.co.cr/tierra-rica-enriquesida-vitaminada-22lt-4/p
Librera Mainstays de 5 divisiones color roble modelo MS20-D1-1009-35,34.900,N/A,https://www.walmart.co.cr/ms-librera-divisiones-color-oak-2/p
Ganchos Mainstays Set 6 Und Blanco,1.540,N/A,https://www.walmart.co.cr/ganchos-mainstays-set-und-blanco-4/p
Regleta Voltage Multiple con 2 puertos USB,3.800,N/A,https://www.walmart.co.cr/regleta-multiple-con-2-puertos-usb-2/p
Candela Votiva Cherry,1.500,N/A,https://www.walmart.co.cr/candela-votiva-cherry-4/p
Semillas Culantro Sol Naciente,1.030,N/A,https://www.walmart.co.cr/semillas-culantro-marca-sol-naciente/p
Set Mainstays de Cuchillos con Base de Madera - 5 Piezas,4.000,N/A,https://www.walmart.co.cr/cuchillos-5pc-maintays-base-madera-unidad-4/p
Caja Home Pro Organizadora Con Cierre - 6lt,2.200,N/A,https://www.walmart.co.cr/caja-organizadora-home-pro-con-cierre-6lt-4/p
Sartenes George Home - 3 Pack,12.0008.000,N/A,https://www.walmart.co.cr/sartenes-george-home-3-pack/p
Colchón Serta Tamaño King Perfect Balance Medio,399.900211.900,N/A,https://www.walmart.co.cr/serta-colchon-king-perfectbalance-medio/p
Sillón Mainstays reclinable individual de cuero,244.900,N/A,https://www.walmart.co.cr/ms-sillon-reclinable-individual-leather/p
Prensas ainstays De Ropa Plastica M - 30 Piezas,950,N/A,https://www.walmart.co.cr/prensas-ropa-plastica-mainstays-30-piezas-4/p
Incienso Bic Sandal Gopinath - Unidad,850,N/A,https://www.walmart.co.cr/incienso-bic-sandal-gopinath-unidad-4/p
Ms Set De Pichel Con 5 Vasos De Vidrio,3.100,N/A,https://www.walmart.co.cr/ms-set-de-pichel-con-5-vasos-de-vidrio/p
Carbón vegetal Great Value briquetas 100% natural bolsa - 2 kg,2.4502.000,N/A,https://www.walmart.co.cr/carbon-vegetal-great-value-briquetas-100--natural-bolsa-2-kg/p
"Mochila Pen Gear, con diseño de patitas",4.5001.000,N/A,https://www.walmart.co.cr/mochila-pengear-delfines-modelo-ah2211pink-4/p
Mini Papelero Infantil,1.360950,N/A,https://www.walmart.co.cr/mini-papelero-infantil-66-17ene25/p
Cuaderno Pen-Gear universitario pasta dura - 200 hojas,2.300550,N/A,https://www.walmart.co.cr/cuaderno-marca-pen-gear-pride-150-hojas-3/p
Stand Home Trends para TV de madera clara - 120 cm,37.900,N/A,https://www.walmart.co.cr/ms-tv-stand-120cm-madera-clara/p
Contenedor Lilo & Stitch de vidrio -230 ml,1.300,N/A,https://www.walmart.co.cr/contenedor-de-vidrio-lilo-stitch-230ml/p
Closet Mainstays Mayer Fresno Wengue,149.900,N/A,https://www.walmart.co.cr/closet-mayerfresno-173x141x38cm/p
Comal Mainstays De Aluminio - 26cm,3.000,N/A,https://www.walmart.co.cr/comal-mainstays-aluminio-26cm-4/p
"Batería Energizer,Blister AAA -16 uds",4.670,N/A,https://www.walmart.co.cr/bateria-energizer-blister-aaa-16u-1ea/p
Encendedor Tokai Antorcha Vector Recargable - unidad,1.250,N/A,https://www.walmart.co.cr/tokai-encendedor-antorcha-desech-junior-4/p
Basurero Redondo Acero Inox Pedal 30l,13.5009.000,N/A,https://www.walmart.co.cr/basurero-redondo-acero-inox-pedal-30l/p
Sillón reclinable Home Trends doble color café,249.900209.900,N/A,https://www.walmart.co.cr/ht-sillon-reclin-doble-cafe-138x91-5x102/p
Maleta Friends Television Colors,27.900,N/A,https://www.walmart.co.cr/maleta-friends-television-colors/p
Desatorador Adarga de Canerias - 1000ml,5.000,N/A,https://www.walmart.co.cr/desatorador-escudo-canerias-1000ml/p
Sofá infantil Mainstays con forma de oso color azul,53.900,N/A,https://www.walmart.co.cr/ms-sofa-infantil-oso-azul/p
Dispensador Mainstays De Vidrio - 2 Galones,6.250,N/A,https://www.walmart.co.cr/dispensador-mainstays-vidrio-galones-4/p
Pichel De Vidrio Primavera 1.5 Lt 5414,1.850,N/A,https://www.walmart.co.cr/pichel-vidrio-primavera-1-5-lt-5414-4/p
Balde Uchosa Con Tapa Transparente - 18 lt,3.400,N/A,https://www.walmart.co.cr/balde-uchosa-con-tapa-transparente-18-lt/p
Bombillo Great Value Led A60 Luz Amarilla -7 Watts,1.100,N/A,https://www.walmart.co.cr/bombillo-led-7w-luz-amarilla-4/p
"Encendedor Vox multipropósito,extra seguro,mantiene los dedos lejos de la llama.",800,N/A,https://www.walmart.co.cr/encendedor-multiproposito-4/p
Estante para baño 3 niveles Mainstays color blanco,7.600,N/A,https://www.walmart.co.cr/ms-estante-para-bano-blanco-3-niv/p
Silla Mainstays plegable,5.900,N/A,https://www.walmart.co.cr/msk-silla-plegabl-infant-36-39-57gris/p
Rallador George Home 4 Lados - Unidad,1.200,N/A,https://www.walmart.co.cr/rallador-george-home-lados-unidad/p
Exprimidor de Limón Mainstays,1.100,N/A,https://www.walmart.co.cr/cross-mainstays-exprimidor-de-limon-4/p
Pegamento Instantáneo Loctite Super Bonder Original - 3g,2.600,N/A,https://www.walmart.co.cr/adhesivo-loctite-super-bonder-orig-3gr/p
Clasificador de malla Mainstays de 3 contenedores,6.5004.000,N/A,https://www.walmart.co.cr/clasificador-de-malla-de-3-contenedores/p
Cepillo de Lavado 25 cm Extensión 122 cm,6.000,N/A,https://www.walmart.co.cr/cepillo-lavado-25-cm-extension-122-cm/p
Aceite Wd 40 Multiuso Ideal para Proteger metal - 5.5oz,2.740,N/A,https://www.walmart.co.cr/wd-40-presentacion-5-5-onzas/p
Mesa para laptop Mainstays altura ajustable colores surtidos Nt5378Whtwmw,18.000,N/A,https://www.walmart.co.cr/mesa-mainstays-para-laptop-altura-ajustable-negra/p
Batería Cocina 7Pcs Negra Mainstays,15.000,N/A,https://www.walmart.co.cr/bateria-cocina-7pcs-negra-mainstays/p
Tendedero Mainstays 18 Prensas Ovalado - Unidad,1.400,N/A,https://www.walmart.co.cr/tendedero-mainstays-18-prensas-ovalado-unidad/p
Set Uchosa Gancho  Negro no.14 - 10 piezas,1.900,N/A,https://www.walmart.co.cr/set-gancho-uchosa-10pz-negro-n14-4/p
Recipiente Kitchen Pro De 900ml,800,N/A,https://www.walmart.co.cr/recipiente-kitchen-pro-de-900ml/p
Taza De Café Vidrio Mainstays 12Oz,450,N/A,https://www.walmart.co.cr/taza-cafe-vidrio-mainstays-12oz-4/p
Cilindro de gas Jumbo Star butano para cocinas portátiles,1.500,N/A,https://www.walmart.co.cr/cilindro-jumbo-star-unidad/p
Bolsa Gabacha Ecoplanet Reutilizable,120,N/A,https://www.walmart.co.cr/bolsa-gabacha-ecoplanet-reutilizable-4/p
Set Edredon Matrimonial Stitch,33.50020.000,N/A,https://www.walmart.co.cr/set-edredon-matrimonial-stitch/p
Batería para auto LH 51r 500 amp 12 v BATAUTLH007,92.00060.800,N/A,https://www.walmart.co.cr/bateria-lth-51r-500-amp-12v-4/p
Cuaderno Pen-Gear universitario pasta dura color celeste - 200 hojas,2.300550,N/A,https://www.walmart.co.cr/cuaderno-marca-pen-gear-pride-150-hojas-6/p
Colchón Confort life  Tamaño Queen doble boxtop,179.900,N/A,https://www.walmart.co.cr/confort-life-colchon-queen-doble-boxtop/p
Parrilla Expert Grill a carbón y a gas con 3 quemadores,230.000,N/A,https://www.walmart.co.cr/parrilla-expert-grill-a-carbon-y-a-gas-con-3-quemadores/p
Pajilla Mainstays Reutilizable Con Cepillo 9 unidades,825,N/A,https://www.walmart.co.cr/mainstays-pajilla-reu-set-9pcs-c-cepillo/p
Saca Corcho Mainstays Cork Screw - Unidad,850,N/A,https://www.walmart.co.cr/chef-craft-saca-corcho-mainstays-unidad/p
Toldo Ozark Trail básico colores surtidos - 3 x 3m,14.900,N/A,https://www.walmart.co.cr/toldo-3x3mt-4/p
Batería Panasonic Alcalina Evolta AAA - 6 Unidades,3.900,N/A,https://www.walmart.co.cr/bateria-panasonic-alcalina-evolta-aaa-unidades-4/p
Colchón King Koil Tamaño Queen resplandor,269.000,N/A,https://www.walmart.co.cr/colchon-marca-king-koil-queen-resplandor/p
"Mesa Mainstays Plegable De 6 PiesTamaño Del Producto (Cm): 182,8X76X73,7 CmDoblado A La Mitad. Tablero De Pp Moldeado Al Vacío",28.900,N/A,https://www.walmart.co.cr/mesa-plegable-plastica-azul-mainstays-182-cm/p
Silla de Resina Plegable Mainstays Robusta -unidad,13.200,N/A,https://www.walmart.co.cr/silla-resina-mainstays-plegable-robusta-unidad/p
Prensas  Mainstays  De Ropa Madera- 20 Piezas,450,N/A,https://www.walmart.co.cr/prensas-ropa-madera-mainstays-20-piezas-4/p
Dispensador Mainstays para jabon líquido crema corporal color gris - 1 ud,2.800,N/A,https://www.walmart.co.cr/planta-marca-mainstays-artificial-maceta-plastico-60cm-142/p
Almohada American Dream Blanca 2 unidades 144H,5.900,N/A,https://www.walmart.co.cr/almohada-american-dream-blanca-2-unidades-144h/p
Planchador Metálico Mainstays 4 Patas - Unidad,12.000,N/A,https://www.walmart.co.cr/planchador-metalico-mainstays-patas-unidad-4/p
Servilletero De Metal,950,N/A,https://www.walmart.co.cr/servilletero-de-metal-43/p
Recipiente Kitchen Pro De 1500ml,950,N/A,https://www.walmart.co.cr/recipiente-kitchen-pro-de-1500ml/p
Marcador Artline 109 permanente colores surtidos - 2 uds,1.200,N/A,https://www.walmart.co.cr/marcador-artline-107-permanente-2-unidades-2/p
"Abrillantador Nais Spray Rociador, Protege Y Restaura - 236ml",3.540,N/A,https://www.walmart.co.cr/limp-p-aut-nais-multius-c-rociad-236-ml/p
Escurridor Para Platos Hometrends,4.5002.000,N/A,https://www.walmart.co.cr/escurridor-para-platos-hometrends/p
Botella Vidrio Con Tapa Plastico 800ml,880500,N/A,https://www.walmart.co.cr/botella-vidrio-con-tapa-plastico-800ml/p
Organizador Mainstays para refrigeradora -7 L,4.000,N/A,https://www.walmart.co.cr/organizador-marca-mainstays-7-lt/p
Cinta Pen Gear adhesiva transparente,330,N/A,https://www.walmart.co.cr/cinta-adhesiva-pengear-transparente-modelo-cmjs2308-4/p
Set 16 Cubiertos Plateados George Home,3.700,N/A,https://www.walmart.co.cr/set-16-cubiertos-plateados-george-home-76/p
Exprimidor Limón Mainstays Color Amarillo - Unidad,800,N/A,https://www.walmart.co.cr/exprimidor-limon-mainstays-color-amarillo-unidad-4/p
Nottas Hojas Papel Bond 100h Blancas,950,N/A,https://www.walmart.co.cr/nottas-hojas-papel-bond-100h-blancas/p
Toalla  Auto Drive multipropósitos de microfibra surtida 40 x 40 cm,600,N/A,https://www.walmart.co.cr/toalla-multi-funcion-40cmx40cm-4/p
Mesa Hometrends auxiliar redonda mármol,19.500,N/A,https://www.walmart.co.cr/ht-mesa-auxiliar-redonda-marmol-50cm/p
Dispensador Mainstays para jabón líquido crema corporal color verde - 1 ud,2.200,N/A,https://www.walmart.co.cr/planta-marca-mainstays-artificial-maceta-plastico-60cm-135/p
Plástico Adhesivo Artesco 45X3m 80Mic,1.200,N/A,https://www.walmart.co.cr/plastico-adhesivo-artesco-45x3m-80mic/p
Dispensador Mainstays para jabon líquido crema corporal color gris - 1 ud,2.800,N/A,https://www.walmart.co.cr/planta-marca-mainstays-artificial-maceta-plastico-60cm-142/p
Organizador Ropa Intima Mainstays 12 Divisiones,1.100,N/A,https://www.walmart.co.cr/organizador-ropa-intima-mainstays-12-divisiones-unidad/p
Basurero Uchosa Con Tapa Buzon WM - 8LT,2.680,N/A,https://www.walmart.co.cr/basurero-uchosa-con-tapa-buzon-wm-8lt/p
Cuchara Mainstays Para Helado,800,N/A,https://www.walmart.co.cr/cuchara-p-helado-mainstays/p
Afilador Ilko De Cuchillos - unidad,2.940,N/A,https://www.walmart.co.cr/afilador-cuchillo-ilko/p
Bombillo Great Value Espiral Luz Blanca - 15 Watts,1.300,N/A,https://www.walmart.co.cr/ahorrador-espiral-15w-luz-blanca-4/p
Ms Servilletero De Hierro,1.700,N/A,https://www.walmart.co.cr/ms-servilletero-de-hierro/p
"Abrillantador Nais Rociador, Protege Y Restaura - 236ml",3.240,N/A,https://www.walmart.co.cr/abrill-p-auto-nais-protec-bols-236-ml-az/p
Salero y pimentero Jolie 2 en 1 to go,650300,N/A,https://www.walmart.co.cr/salero-y-pimentero-to-go-joie/p
Set de salero y pimentero Joie con forma de gatos - 2 Pzas,3.0001.500,N/A,https://www.walmart.co.cr/set-de-salero-y-pimentero-gatos-joie/p
Llanta Kumho para automóvil  185/65 Rin14 2111373,28.20024.500,N/A,https://www.walmart.co.cr/llanta-kumho-185-65r14/p
Mesa tipo hielera Mainstays de plástico color beige,50.90035.000,N/A,https://www.walmart.co.cr/mesa-mainstays-tipo-hielera-de-plastico-beige/p
Toldo plegable Ozark Trail color azul - 3 x 3 m,17.900,N/A,https://www.walmart.co.cr/toldo-plegable-ozark-trail-3x3-m-azul-4/p
Escritorio Mainstays Biblioteca Vance,99.900,N/A,https://www.walmart.co.cr/escritorio-biblioteca-vance/p
Toldo Ozark Trail tipo tienda para playa color azul,19.500,N/A,https://www.walmart.co.cr/toldo-t-tienda-playa-ozark-t-200x140x165-4/p
Plumero De Microfibra,3.500,N/A,https://www.walmart.co.cr/plumero-de-microfibra/p
Protector de Colchón impermeable Individual,11.900,N/A,https://www.walmart.co.cr/protector-de-colchon-impermeable-individual/p
Bolig Bic Dura Mas Azul Cj 12,1.500,N/A,https://www.walmart.co.cr/bolig-bic-dura-mas-azul-cj-12-4/p
Colchón marca Kingkoil Tamaño King Resplandor,310.000,N/A,https://www.walmart.co.cr/colchon-marca-king-koil-king-resplandor/p
Rodillo De Silicon Mainstays Con Mango De Bambu - Unidad,2.800,N/A,https://www.walmart.co.cr/rodillo-silicon-mainstays-con-mango-bambu-unidad-4/p
Caja organizadora Home pro colores surtidos y capacidad 60 L,6.900,N/A,https://www.walmart.co.cr/caja-organizadora-home-pro-smart-box-60-lts/p
Silla Ozark Trail Con Brazos Y Hielera Surtido Color 96.5cm - 136kg,12.900,N/A,https://www.walmart.co.cr/silla-ozark-t-oversize-mesh-brazos-96-5c/p
Recolector Mainstays De Cabello,900,N/A,https://www.walmart.co.cr/recolector-mainstays-de-cabello/p
Jabonera Mainstays De Cerámica,2.000,N/A,https://www.walmart.co.cr/jabonera-de-ceramica-mainstays-2/p
Masking Tape 48mm X 25 Metros,1.700,N/A,https://www.walmart.co.cr/masking-tape-48mm-x-25-metros/p
