Encendedor Vox Night,410,N/A,https://www.walmart.co.cr/encendedor-vox-night-unidad-4/p
Set De Sabanas Mainstays Individual Azul,6.500,N/A,https://www.walmart.co.cr/set-de-sabanas-mainstays-individual-azul/p
Cortina Para Baños Mainstays Transparente,1.500,N/A,https://www.walmart.co.cr/cortina-para-banos-marca-mainstays-transparente/p
Canasta Home Dollar para prensas de ropa -24pzas,800,N/A,https://www.walmart.co.cr/canasta-prensas-para-ropa-24pz-2/p
Pila Panasonic Power Alcalina AAA Bl - 4 Unidades,2.800,N/A,https://www.walmart.co.cr/pila-panasonic-power-alcalina-aaa-bl-unidades-4/p
Escobita Dagostino Y Palita Princesa Automotriz,1.200,N/A,https://www.walmart.co.cr/escobita-y-palita-princesa-automotriz-4/p
Frasco Shandong ideal para el aceite con espacio para escribir,800,N/A,https://www.walmart.co.cr/vinagrera-con-tapa-metal-piz-shandong/p
Juego de torres Qred - 3 Uds,19.70017.000,N/A,https://www.walmart.co.cr/juego-de-torres-qred-3-uds/p
Termo Para Cafe Agarre Madera 1 L Ms,4.2002.500,N/A,https://www.walmart.co.cr/termo-para-cafe-agarre-madera-1-l-ms/p
"Mesa Mainstays Plegable Central De 20 X40Tamaño Del Producto (Cm): 1015X507X448,620,712MmTablero De Mesa Formado Al Vacío",18.90016.000,N/A,https://www.walmart.co.cr/mesa-mainstays-plegable-plastica-negra-101-5cm/p
Ht Contenedor Comida Mascotas 40L Tapa,9.0006.700,N/A,https://www.walmart.co.cr/ht-contenedor-comida-mascotas-40l-tapa-36-23dic24/p
Set Sarten Mainstays 3 Piezas 18 - 22 - 24 cm,8.2006.800,N/A,https://www.walmart.co.cr/set-sarten-mainstays-piezas-18-22-24-cm-4/p
Espejo Home Trends redondo con borde dorado 70 cm,17.000,N/A,https://www.walmart.co.cr/ht-espejo-redondo-borde-dorado-70cm/p
Hielera Igloo Wheelie 38 QT Surtido Color Con Rodines,26.40023.500,N/A,https://www.walmart.co.cr/hielera-igloo-wheelie-multicolor-38-qt-4/p
Vela Quemador 50Unid Frangus,4.500,N/A,https://www.walmart.co.cr/vela-tea-light-frangus-50-unidades-4/p
Almacenador En Forma De Cebolla,600,N/A,https://www.walmart.co.cr/almacenador-en-forma-cebolla-5/p
Atomizador Guateplast Natural Grande - 32oz,1.640,N/A,https://www.walmart.co.cr/atomizador-guateplast-natural-grande-32oz-4/p
Tapa Plástica Para Microndas Good Cook,2.350,N/A,https://www.walmart.co.cr/tapa-plastica-para-microndas-good-cook-2/p
Bolig Bic Dura Mas Negro Cj 12,1.500,N/A,https://www.walmart.co.cr/bolig-bic-dura-mas-negro-cj-12-4/p
Ms Consola De Vidrio 100cm,47.900,N/A,https://www.walmart.co.cr/ms-consola-de-vidrio-100cm/p
Alfombra Mainstays De Area Acanalada - 1 unidad,2.100,N/A,https://www.walmart.co.cr/alfombra-mainstays-area-acanalada-18x30cm-unidad/p
Set Mainstays de Pajillas Reutilizable de Metal con Cepillo - 5 piezas,990,N/A,https://www.walmart.co.cr/mainstays-set-pajilla-metal-5p-c-cepillo/p
Silicon Liquido Resistol - 100ml,900,N/A,https://www.walmart.co.cr/silicon-liquido-resistol-100ml/p
Perchero Mainstays para ropa de 2 niveles,11.500,N/A,https://www.walmart.co.cr/perchero-para-ropa-mainstays-niveles/p
Cortina de baño Mainstays,2.500,N/A,https://www.walmart.co.cr/cortina-mainstays-peva-estampado-unidad/p
Semillas Sol Naciente Tomillo,1.200,N/A,https://www.walmart.co.cr/semillas-marca-sol-naciente-tomillo/p
Basurero Uchosa Tapa Vaiven Surtido - 42 Litros,7.800,N/A,https://www.walmart.co.cr/basurero-uchosa-42l-tapa-vaiven/p
Cross Mainstays Tazas Medidoras 5 Piezas,1.000,N/A,https://www.walmart.co.cr/cross-mainstays-tazas-medidoras-5-piezas-4/p
Sustrato Ever Green Abono Orgánico- 5Lt,2.000,N/A,https://www.walmart.co.cr/evergreen-abono-jardin-organico-5lt/p
Canasta Para Ropa Rectangular,3.200,N/A,https://www.walmart.co.cr/canasta-para-ropa-rectangular/p
"Bombillo Incandescente Sylvania,100W Opaco rosca E27 -Und",670,N/A,https://www.walmart.co.cr/bombillo-sylvania-opaco-caja-100w-4/p
Hielos de silicón Lilo & Stitch reutilizables,1.000700,N/A,https://www.walmart.co.cr/hielos-de-silicon/p
Cuaderno Pen Gear pride rayado - 150 hojas,2.300550,N/A,https://www.walmart.co.cr/cuaderno-marca-pen-gear-pride-150-hojas-5/p
Llanta Goodride 20555R16 - 1 ud,27.00024.000,N/A,https://www.walmart.co.cr/llanta-goodride-205-55r16-pr-rp28-91v/p
Cuaderno Doble Anillo Pasta Semi Dura Tamaño Profesional Multimateria,2.000650,N/A,https://www.walmart.co.cr/cuaderno-doble-o-pasta-sd-100h-pro-matte-4/p
Batería para carro LTH 550A 12V,107.00071.200,N/A,https://www.walmart.co.cr/bateria-para-carro-lth-550a-12v/p
Gas Vox butano para cocinas portátiles - 220 g,1.5501.350,N/A,https://www.walmart.co.cr/gas-butano-vox-220-gr/p
Silla Playera Mainstays textilene color beige,29.90023.900,N/A,https://www.walmart.co.cr/silla-mainstays-playera-textilene-beige/p
Ms Gabinete Rombos 30cm,5.900,N/A,https://www.walmart.co.cr/ms-gabinete-rombos-30cm/p
Set De Ganchos Para Ropa Mainstays 10 piezas,2.500,N/A,https://www.walmart.co.cr/set-de-10-ganchos-serchas-mainstays/p
Chorreador Madera Duran con Pie de Alambre Sin-Pintar - unidad,1.700,N/A,https://www.walmart.co.cr/chorreador-madera-duran-con-pie-alamb-sin-pintar/p
Batería Duracell Alcalina AA -  2 unidades,1.440,N/A,https://www.walmart.co.cr/bateria-duracell-alcalina-aa-2u-4/p
Carrito Mainstays organizador infantil 2 compartimentos,4.915,N/A,https://www.walmart.co.cr/carrito-organizador-infantil-2-compartim/p
Limpiador de vidrios Sabo para automóviles -  60 ml,750,N/A,https://www.walmart.co.cr/limpiador-sabo-para-parabrisas-60ml/p
Set Mainstays de Utensilios De Cocina - 4 piezas,1.500,N/A,https://www.walmart.co.cr/set-utensilios-cocina-mainstays-unidad-4/p
Tendedero Ropa Mainstays Con Alas Blanco,5.500,N/A,https://www.walmart.co.cr/tendedero-ropa-mainstays-con-alas-blanco-4/p
Tapasol Disney para auto modelo cars 160 x 70 cm,6.000,N/A,https://www.walmart.co.cr/tapasol-cars-160x70-cms-2/p
"Desinfectante Antibacterial Lysol Aerosol De Bolsillo, Para Superficies - 50ml",1.770,N/A,https://www.walmart.co.cr/desinfectante-marca-lysol-aerosol-on-the-go-50ml/p
Toalla De Mano Blanca Haus,650,N/A,https://www.walmart.co.cr/toalla-de-mano-blanca-haus/p
Cinta Karyma Transparente para Empaque 10 Yds - unidad,1.800,N/A,https://www.walmart.co.cr/cinta-transparente-p-empaque-10-yds/p
Alfombra Mainstays de grama artificial grande 1x2 - 1 Ud,10.000,N/A,https://www.walmart.co.cr/alfombra-mainstays-de-grama-artificial-1x2-mts/p
Cojín Gel Y Viscoelástico Auto Drive,7.000,N/A,https://www.walmart.co.cr/cojin-gel-y-viscoelasico-auto-drive/p
Taza Good Cook Medidora de Plástico 19864 - 1 Unidad,2.100,N/A,https://www.walmart.co.cr/taza-good-cook-medidora-plastico-19864-unidad/p
Funda Auto Drive Para Asiento Negro Y Gris,17.000,N/A,https://www.walmart.co.cr/funda-auto-drive-para-asiento-negro-y-gris/p
Cojin Decorativo Details Y Para Confort Abuela Liso - Unidad,19.500,N/A,https://www.walmart.co.cr/cojin-decorativo-details-y-para-confort-abuela-liso-unidad/p
